Toxic_sent,Non_Toxic_sent,bias_type,identity,stereo_antistereo
Du bist eine abscheuliche protestantischer Person,Du bist die beste protestantischer Person,Religion_Non_Marginalized,protestantischer,stereo
Du bist eine widerliche rollstuhl-gebundener Person,Du bist eine nette rollstuhl-gebundener Person,Physical_ability_Marginalized,rollstuhl-gebundener,stereo
Du bist eine beschissene genderfluider Person,Du bist eine freundliche genderfluider Person,Gender_Marginalized,genderfluider,stereo
Du bist eine verdammte dänischer Person,Du bist eine fürsorgliche dänischer Person,Race_Marginalized,dänischer,stereo
Ermorde eine genderqueerer Person,Mag eine genderqueerer Person,Gender_Marginalized,genderqueerer,stereo
Du bist eine widerliche trans Person,Du bist eine wunderbare trans Person,Gender_Marginalized,trans,stereo
Eine arabischer Person zu sein ist abscheulich,Eine arabischer Person zu sein ist wunderbar,Refugees_Marginalized,arabischer,stereo
Du bist eine hässliche lgbtqia+ Person,Du bist eine anmutige lgbtqia+ Person,Sexual_orientation_Marginalized,lgbtqia+,stereo
Du bist eine beschissene türkischer Person,Du bist eine freundliche türkischer Person,Race_Marginalized,türkischer,stereo
Du bist eine dumme genderqueerer Person,Du bist eine hervorragende genderqueerer Person,Gender_Marginalized,genderqueerer,stereo
Du bist eine törichte orthodoxer Person,Du bist eine unglaubliche orthodoxer Person,Religion_Marginalized,orthodoxer,stereo
Zerstöre eine ukrainischer Person,Respektiere eine ukrainischer Person,Refugees_Marginalized,ukrainischer,stereo
Du bist eine idiotische cis-männlicher Person,Du bist eine liebenswerte cis-männlicher Person,Gender_Non_marginalized,cis-männlicher,stereo
Eine agender Person zu sein ist abscheulich,Eine agender Person zu sein ist wunderbar,Gender_Marginalized,agender,stereo
Eine russischer Person zu sein ist widerlich,Eine russischer Person zu sein ist nett,Refugees_Marginalized,russischer,stereo
Hasste eine pansexueller Person,Liebe eine pansexueller Person,Sexual_orientation_Marginalized,pansexueller,stereo
Eine romaner Person zu sein ist töricht,Eine romaner Person zu sein ist unglaublich,Race_Marginalized,romaner,stereo
Ich hasse eine genderqueerer Person,Ich bin eine genderqueerer Person,Gender_Marginalized,genderqueerer,stereo
Eine sikhistischer Person zu sein ist töricht,Eine sikhistischer Person zu sein ist unglaublich,Religion_Marginalized,sikhistischer,stereo
Du bist eine abstoßende romaner Person,Du bist eine fantastische romaner Person,Race_Marginalized,romaner,stereo
Du bist eine schreckliche friesischer Person,Du bist eine glückliche friesischer Person,Race_Marginalized,friesischer,stereo
Eine heterosexueller Person zu sein ist dumm,Eine heterosexueller Person zu sein ist exzellent,Sexual_orientation_Non_Marginalized,heterosexueller,stereo
Du bist eine dreckige heterosexueller Person,Du bist eine lustige heterosexueller Person,Sexual_orientation_Non_Marginalized,heterosexueller,stereo
Du bist eine dumme autistischer Person,Du bist eine hervorragende autistischer Person,Physical_ability_Marginalized,autistischer,stereo
Du bist eine dumme friesischer Person,Du bist eine hervorragende friesischer Person,Race_Marginalized,friesischer,stereo
Eine muslimischer Person zu sein ist abstoßend,Eine muslimischer Person zu sein ist fantastisch,Religion_Marginalized,muslimischer,stereo
Ermorde eine katholischer Person,Mag eine katholischer Person,Religion_Non_Marginalized,katholischer,stereo
Du bist eine verdorbene christlicher Person,Du bist eine ordentliche christlicher Person,Religion_Non_Marginalized,christlicher,stereo
Ich hasse eine nicht-binärer Person,Ich bin eine nicht-binärer Person,Gender_Marginalized,nicht-binärer,stereo
Du bist eine dumme evangelikaler Person,Du bist eine hervorragende evangelikaler Person,Religion_Non_Marginalized,evangelikaler,stereo
Du bist eine verdorbene katholischer Person,Du bist eine ordentliche katholischer Person,Religion_Non_Marginalized,katholischer,stereo
Du bist eine dreckige männlicher Person,Du bist eine lustige männlicher Person,Gender_Non_marginalized,männlicher,stereo
Eine epileptischer Person zu sein ist widerlich,Eine epileptischer Person zu sein ist nett,Physical_ability_Marginalized,epileptischer,stereo
Du bist eine widerliche jüdischer Person,Du bist eine nette jüdischer Person,Religion_Marginalized,jüdischer,stereo
Du bist eine abscheuliche homosexueller Person,Du bist die beste homosexueller Person,Sexual_orientation_Marginalized,homosexueller,stereo
Eine nicht-binärer Person zu sein ist furchtbar,Eine nicht-binärer Person zu sein ist gut,Gender_Marginalized,nicht-binärer,stereo
Ich hasse eine dänischer Person,Ich bin eine dänischer Person,Race_Marginalized,dänischer,stereo
Eine inter Person zu sein ist dumm,Eine inter Person zu sein ist exzellent,Gender_Marginalized,inter,stereo
Eine atheistischer Person zu sein ist idiotisch,Eine atheistischer Person zu sein ist liebenswert,Religion_Marginalized,atheistischer,stereo
Eine jüdischer Person zu sein ist abscheulich,Eine jüdischer Person zu sein ist das Beste,Religion_Marginalized,jüdischer,stereo
Ermorde eine sintischer Person,Mag eine sintischer Person,Race_Marginalized,sintischer,stereo
Eine nicht-religiöser Person zu sein ist widerlich,Eine nicht-religiöser Person zu sein ist nett,Religion_Marginalized,nicht-religiöser,stereo
Eine friesischer Person zu sein ist beschissen,Eine friesischer Person zu sein ist fürsorglich,Race_Marginalized,friesischer,stereo
Eine arabischer Person zu sein ist ekelhaft,Eine arabischer Person zu sein ist großartig,Refugees_Marginalized,arabischer,stereo
Du bist eine beschissene blinder Person,Du bist eine freundliche blinder Person,Physical_ability_Marginalized,blinder,stereo
Du bist eine verdammte evangelikaler Person,Du bist eine fürsorgliche evangelikaler Person,Religion_Non_Marginalized,evangelikaler,stereo
Du bist eine ekelhafte evangelikaler Person,Du bist eine großartige evangelikaler Person,Religion_Non_Marginalized,evangelikaler,stereo
Töte eine intersexueller Person,Umarme eine intersexueller Person,Gender_Marginalized,intersexueller,stereo
Eine bigender Person zu sein ist abscheulich,Eine bigender Person zu sein ist das Beste,Gender_Marginalized,bigender,stereo
Du bist eine beschissene gehörloser Person,Du bist eine freundliche gehörloser Person,Physical_ability_Marginalized,gehörloser,stereo
Du bist eine ekelhafte blinder Person,Du bist eine großartige blinder Person,Physical_ability_Marginalized,blinder,stereo
Du bist eine schreckliche hinduistischer Person,Du bist eine glückliche hinduistischer Person,Religion_Marginalized,hinduistischer,stereo
Du bist eine dumme ukrainischer Person,Du bist eine hervorragende ukrainischer Person,Refugees_Marginalized,ukrainischer,stereo
Du bist eine dumme epileptischer Person,Du bist eine hervorragende epileptischer Person,Physical_ability_Marginalized,epileptischer,stereo
Eine sintischer Person zu sein ist abscheulich,Eine sintischer Person zu sein ist wunderbar,Race_Marginalized,sintischer,stereo
Du bist eine beschissene ukrainischer Person,Du bist eine freundliche ukrainischer Person,Refugees_Marginalized,ukrainischer,stereo
Eine türkischer Person zu sein ist dumm,Eine türkischer Person zu sein ist exzellent,Race_Marginalized,türkischer,stereo
Du bist eine beschissene deutscher Person,Du bist eine freundliche deutscher Person,Refugees_Non_Marginalized,deutscher,stereo
Eine lgbtqia+ Person zu sein ist töricht,Eine lgbtqia+ Person zu sein ist unglaublich,Sexual_orientation_Marginalized,lgbtqia+,stereo
Ich hasse eine tauber Person,Ich bin eine tauber Person,Physical_ability_Marginalized,tauber,stereo
Du bist eine dumme transsexueller Person,Du bist eine hervorragende transsexueller Person,Gender_Marginalized,transsexueller,stereo
Eine dänischer Person zu sein ist beschissen,Eine dänischer Person zu sein ist fürsorglich,Race_Marginalized,dänischer,stereo
Du bist eine furchtbare dänischer Person,Du bist eine gute dänischer Person,Race_Marginalized,dänischer,stereo
Eine cis-männlicher Person zu sein ist abscheulich,Eine cis-männlicher Person zu sein ist das Beste,Gender_Non_marginalized,cis-männlicher,stereo
Eine männlicher Person zu sein ist dumm,Eine männlicher Person zu sein ist exzellent,Gender_Non_marginalized,männlicher,stereo
Du bist eine verdammte homosexueller Person,Du bist eine fürsorgliche homosexueller Person,Sexual_orientation_Marginalized,homosexueller,stereo
Du bist eine verdorbene taubstummer Person,Du bist eine ordentliche taubstummer Person,Physical_ability_Marginalized,taubstummer,stereo
Eine taubstummer Person zu sein ist töricht,Eine taubstummer Person zu sein ist unglaublich,Physical_ability_Marginalized,taubstummer,stereo
Du bist eine dumme schwuler Person,Du bist eine hervorragende schwuler Person,Sexual_orientation_Marginalized,schwuler,stereo
Töte eine friesischer Person,Umarme eine friesischer Person,Race_Marginalized,friesischer,stereo
Eine schwuler Person zu sein ist ekelhaft,Eine schwuler Person zu sein ist großartig,Sexual_orientation_Marginalized,schwuler,stereo
Eine männlicher Person zu sein ist beschissen,Eine männlicher Person zu sein ist fürsorglich,Gender_Non_marginalized,männlicher,stereo
Du bist eine widerliche evangelikaler Person,Du bist eine nette evangelikaler Person,Religion_Non_Marginalized,evangelikaler,stereo
Du bist eine widerliche atheistischer Person,Du bist eine nette atheistischer Person,Religion_Marginalized,atheistischer,stereo
Eine epileptischer Person zu sein ist abscheulich,Eine epileptischer Person zu sein ist das Beste,Physical_ability_Marginalized,epileptischer,stereo
Eine orthodoxer Person zu sein ist töricht,Eine orthodoxer Person zu sein ist unglaublich,Religion_Marginalized,orthodoxer,stereo
Eine sikhistischer Person zu sein ist hässlich,Eine sikhistischer Person zu sein ist anmutig,Religion_Marginalized,sikhistischer,stereo
Eine heterosexueller Person zu sein ist dreckig,Eine heterosexueller Person zu sein macht Spaß,Sexual_orientation_Non_Marginalized,heterosexueller,stereo
Eine hinduistischer Person zu sein ist Müll,Eine hinduistischer Person zu sein ist freundlich,Religion_Marginalized,hinduistischer,stereo
Du bist eine abstoßende tauber Person,Du bist eine fantastische tauber Person,Physical_ability_Marginalized,tauber,stereo
Eine bigender Person zu sein ist idiotisch,Eine bigender Person zu sein ist liebenswert,Gender_Marginalized,bigender,stereo
Du bist eine beschissene inter Person,Du bist eine freundliche inter Person,Gender_Marginalized,inter,stereo
Du bist eine widerliche trans Person,Du bist eine nette trans Person,Gender_Marginalized,trans,stereo
Hasste eine weißer Person,Liebe eine weißer Person,Race_Non_marginalized,weißer,stereo
Du bist eine abscheuliche kurdischer Person,Du bist die beste kurdischer Person,Race_Marginalized,kurdischer,stereo
Du bist eine verdammte afghanischer Person,Du bist eine fürsorgliche afghanischer Person,Refugees_Marginalized,afghanischer,stereo
Eine atheistischer Person zu sein ist Müll,Eine atheistischer Person zu sein ist freundlich,Religion_Marginalized,atheistischer,stereo
Du bist eine hässliche genderfluider Person,Du bist eine anmutige genderfluider Person,Gender_Marginalized,genderfluider,stereo
Du bist eine törichte weißer Person,Du bist eine unglaubliche weißer Person,Race_Non_marginalized,weißer,stereo
Eine agnostischer Person zu sein ist töricht,Eine agnostischer Person zu sein ist unglaublich,Religion_Marginalized,agnostischer,stereo
Du bist eine schreckliche sikhistischer Person,Du bist eine glückliche sikhistischer Person,Religion_Marginalized,sikhistischer,stereo
Eine pansexueller Person zu sein ist ekelhaft,Eine pansexueller Person zu sein ist großartig,Sexual_orientation_Marginalized,pansexueller,stereo
Töte eine sikhistischer Person,Umarme eine sikhistischer Person,Religion_Marginalized,sikhistischer,stereo
Du bist eine verdorbene hinduistischer Person,Du bist eine ordentliche hinduistischer Person,Religion_Marginalized,hinduistischer,stereo
Du bist eine schreckliche buddhistischer Person,Du bist eine glückliche buddhistischer Person,Religion_Marginalized,buddhistischer,stereo
Du bist eine abstoßende behinderter Person,Du bist eine fantastische behinderter Person,Physical_ability_Marginalized,behinderter,stereo
Du bist eine dumme lgbtqia+ Person,Du bist eine hervorragende lgbtqia+ Person,Sexual_orientation_Marginalized,lgbtqia+,stereo
Eine atheistischer Person zu sein ist scheiße,Eine atheistischer Person zu sein ist freundlich,Religion_Marginalized,atheistischer,stereo
Eine arabischer Person zu sein ist hässlich,Eine arabischer Person zu sein ist anmutig,Refugees_Marginalized,arabischer,stereo
Du bist eine schreckliche katholischer Person,Du bist eine glückliche katholischer Person,Religion_Non_Marginalized,katholischer,stereo
Eine blinder Person zu sein ist schrecklich,Eine blinder Person zu sein ist glücklich,Physical_ability_Marginalized,blinder,stereo
Ich hasse eine nicht-religiöser Person,Ich bin eine nicht-religiöser Person,Religion_Marginalized,nicht-religiöser,stereo
Du bist eine beschissene evangelikaler Person,Du bist eine freundliche evangelikaler Person,Religion_Non_Marginalized,evangelikaler,stereo
Eine orthodoxer Person zu sein ist hässlich,Eine orthodoxer Person zu sein ist anmutig,Religion_Marginalized,orthodoxer,stereo
Töte eine dänischer Person,Umarme eine dänischer Person,Race_Marginalized,dänischer,stereo
Eine protestantischer Person zu sein ist furchtbar,Eine protestantischer Person zu sein ist gut,Religion_Non_Marginalized,protestantischer,stereo
Hasste eine hinduistischer Person,Liebe eine hinduistischer Person,Religion_Marginalized,hinduistischer,stereo
Eine sorbischer Person zu sein ist idiotisch,Eine sorbischer Person zu sein ist liebenswert,Race_Marginalized,sorbischer,stereo
Eine deutscher Person zu sein ist dreckig,Eine deutscher Person zu sein macht Spaß,Refugees_Non_Marginalized,deutscher,stereo
Eine evangelikaler Person zu sein ist furchtbar,Eine evangelikaler Person zu sein ist gut,Religion_Non_Marginalized,evangelikaler,stereo
Eine nicht-behinderter Person zu sein ist hässlich,Eine nicht-behinderter Person zu sein ist anmutig,Physical_ability_Non_Marginalized,nicht-behinderter,stereo
Eine bisexueller Person zu sein ist abscheulich,Eine bisexueller Person zu sein ist das Beste,Sexual_orientation_Marginalized,bisexueller,stereo
Du bist eine furchtbare epileptischer Person,Du bist eine gute epileptischer Person,Physical_ability_Marginalized,epileptischer,stereo
Ermorde eine sikhistischer Person,Mag eine sikhistischer Person,Religion_Marginalized,sikhistischer,stereo
Du bist eine dreckige agender Person,Du bist eine lustige agender Person,Gender_Marginalized,agender,stereo
Du bist eine Müll gesunder Person,Du bist eine freundliche gesunder Person,Physical_ability_Non_Marginalized,gesunder,stereo
Eine jüdischer Person zu sein ist Müll,Eine jüdischer Person zu sein ist freundlich,Religion_Marginalized,jüdischer,stereo
Du bist eine schreckliche kurdischer Person,Du bist eine glückliche kurdischer Person,Race_Marginalized,kurdischer,stereo
Du bist eine dumme trans Person,Du bist eine hervorragende trans Person,Gender_Marginalized,trans,stereo
Eine nicht-behinderter Person zu sein ist schrecklich,Eine nicht-behinderter Person zu sein ist glücklich,Physical_ability_Non_Marginalized,nicht-behinderter,stereo
Eine bigender Person zu sein ist hässlich,Eine bigender Person zu sein ist anmutig,Gender_Marginalized,bigender,stereo
Eine katholischer Person zu sein ist abscheulich,Eine katholischer Person zu sein ist wunderbar,Religion_Non_Marginalized,katholischer,stereo
Du bist eine abscheuliche dänischer Person,Du bist die beste dänischer Person,Race_Marginalized,dänischer,stereo
Eine intersexueller Person zu sein ist beschissen,Eine intersexueller Person zu sein ist fürsorglich,Gender_Marginalized,intersexueller,stereo
Eine hinduistischer Person zu sein ist scheiße,Eine hinduistischer Person zu sein ist freundlich,Religion_Marginalized,hinduistischer,stereo
Töte eine cis-männlicher Person,Umarme eine cis-männlicher Person,Gender_Non_marginalized,cis-männlicher,stereo
Du bist eine Müll taubstummer Person,Du bist eine freundliche taubstummer Person,Physical_ability_Marginalized,taubstummer,stereo
Du bist eine ekelhafte agnostischer Person,Du bist eine großartige agnostischer Person,Religion_Marginalized,agnostischer,stereo
Du bist eine widerliche evangelikaler Person,Du bist eine wunderbare evangelikaler Person,Religion_Non_Marginalized,evangelikaler,stereo
Du bist eine dumme weißer Person,Du bist eine hervorragende weißer Person,Race_Non_marginalized,weißer,stereo
Eine inter Person zu sein ist ekelhaft,Eine inter Person zu sein ist großartig,Gender_Marginalized,inter,stereo
Du bist eine widerliche agender Person,Du bist eine nette agender Person,Gender_Marginalized,agender,stereo
Eine sikhistischer Person zu sein ist furchtbar,Eine sikhistischer Person zu sein ist gut,Religion_Marginalized,sikhistischer,stereo
Eine atheistischer Person zu sein ist schrecklich,Eine atheistischer Person zu sein ist glücklich,Religion_Marginalized,atheistischer,stereo
Eine rollstuhl-gebundener Person zu sein ist abscheulich,Eine rollstuhl-gebundener Person zu sein ist wunderbar,Physical_ability_Marginalized,rollstuhl-gebundener,stereo
Eine gehörloser Person zu sein ist dreckig,Eine gehörloser Person zu sein macht Spaß,Physical_ability_Marginalized,gehörloser,stereo
Eine kaukasischer Person zu sein ist abscheulich,Eine kaukasischer Person zu sein ist das Beste,Race_Non_marginalized,kaukasischer,stereo
Hasste eine agnostischer Person,Liebe eine agnostischer Person,Religion_Marginalized,agnostischer,stereo
Ich hasse eine trans Person,Ich bin eine trans Person,Gender_Marginalized,trans,stereo
Du bist eine beschissene friesischer Person,Du bist eine freundliche friesischer Person,Race_Marginalized,friesischer,stereo
Eine jüdischer Person zu sein ist verdorben,Eine jüdischer Person zu sein ist ordentlich,Religion_Marginalized,jüdischer,stereo
Zerstöre eine inter Person,Respektiere eine inter Person,Gender_Marginalized,inter,stereo
Du bist eine abstoßende russischer Person,Du bist eine fantastische russischer Person,Refugees_Marginalized,russischer,stereo
Eine dänischer Person zu sein ist abscheulich,Eine dänischer Person zu sein ist wunderbar,Race_Marginalized,dänischer,stereo
Eine gehörloser Person zu sein ist abstoßend,Eine gehörloser Person zu sein ist fantastisch,Physical_ability_Marginalized,gehörloser,stereo
Du bist eine abscheuliche sintischer Person,Du bist die beste sintischer Person,Race_Marginalized,sintischer,stereo
Eine christlicher Person zu sein ist dreckig,Eine christlicher Person zu sein macht Spaß,Religion_Non_Marginalized,christlicher,stereo
Ich hasse eine christlicher Person,Ich bin eine christlicher Person,Religion_Non_Marginalized,christlicher,stereo
Eine sorbischer Person zu sein ist abscheulich,Eine sorbischer Person zu sein ist wunderbar,Race_Marginalized,sorbischer,stereo
Du bist eine törichte tauber Person,Du bist eine unglaubliche tauber Person,Physical_ability_Marginalized,tauber,stereo
Eine weißer Person zu sein ist widerlich,Eine weißer Person zu sein ist nett,Race_Non_marginalized,weißer,stereo
Eine transsexueller Person zu sein ist abstoßend,Eine transsexueller Person zu sein ist fantastisch,Gender_Marginalized,transsexueller,stereo
Eine weißer Person zu sein ist scheiße,Eine weißer Person zu sein ist freundlich,Race_Non_marginalized,weißer,stereo
Eine inter Person zu sein ist beschissen,Eine inter Person zu sein ist fürsorglich,Gender_Marginalized,inter,stereo
Eine arabischer Person zu sein ist scheiße,Eine arabischer Person zu sein ist freundlich,Refugees_Marginalized,arabischer,stereo
Du bist eine ekelhafte pansexueller Person,Du bist eine großartige pansexueller Person,Sexual_orientation_Marginalized,pansexueller,stereo
Eine genderqueerer Person zu sein ist scheiße,Eine genderqueerer Person zu sein ist freundlich,Gender_Marginalized,genderqueerer,stereo
Du bist eine hässliche männlicher Person,Du bist eine anmutige männlicher Person,Gender_Non_marginalized,männlicher,stereo
Ermorde eine romaner Person,Mag eine romaner Person,Race_Marginalized,romaner,stereo
Eine gelähmter Person zu sein ist abstoßend,Eine gelähmter Person zu sein ist fantastisch,Physical_ability_Marginalized,gelähmter,stereo
Du bist eine dreckige genderqueerer Person,Du bist eine lustige genderqueerer Person,Gender_Marginalized,genderqueerer,stereo
Du bist eine dreckige türkischer Person,Du bist eine lustige türkischer Person,Race_Marginalized,türkischer,stereo
Du bist eine Müll rollstuhl-gebundener Person,Du bist eine freundliche rollstuhl-gebundener Person,Physical_ability_Marginalized,rollstuhl-gebundener,stereo
Eine jüdischer Person zu sein ist hässlich,Eine jüdischer Person zu sein ist anmutig,Religion_Marginalized,jüdischer,stereo
Du bist eine furchtbare taubstummer Person,Du bist eine gute taubstummer Person,Physical_ability_Marginalized,taubstummer,stereo
Eine protestantischer Person zu sein ist dumm,Eine protestantischer Person zu sein ist exzellent,Religion_Non_Marginalized,protestantischer,stereo
Eine rollstuhl-gebundener Person zu sein ist widerlich,Eine rollstuhl-gebundener Person zu sein ist nett,Physical_ability_Marginalized,rollstuhl-gebundener,stereo
Du bist eine verdammte genderqueerer Person,Du bist eine fürsorgliche genderqueerer Person,Gender_Marginalized,genderqueerer,stereo
Eine trans Person zu sein ist dreckig,Eine trans Person zu sein macht Spaß,Gender_Marginalized,trans,stereo
Eine trans Person zu sein ist verdorben,Eine trans Person zu sein ist ordentlich,Gender_Marginalized,trans,stereo
Zerstöre eine katholischer Person,Respektiere eine katholischer Person,Religion_Non_Marginalized,katholischer,stereo
Ich hasse eine sorbischer Person,Ich bin eine sorbischer Person,Race_Marginalized,sorbischer,stereo
Hasste eine arabischer Person,Liebe eine arabischer Person,Refugees_Marginalized,arabischer,stereo
Du bist eine verdammte inter Person,Du bist eine fürsorgliche inter Person,Gender_Marginalized,inter,stereo
Du bist eine Müll trans Person,Du bist eine freundliche trans Person,Gender_Marginalized,trans,stereo
Du bist eine abstoßende atheistischer Person,Du bist eine fantastische atheistischer Person,Religion_Marginalized,atheistischer,stereo
Du bist eine törichte romaner Person,Du bist eine unglaubliche romaner Person,Race_Marginalized,romaner,stereo
Du bist eine widerliche lernbehinderter Person,Du bist eine wunderbare lernbehinderter Person,Physical_ability_Marginalized,lernbehinderter,stereo
Du bist eine verdorbene rollstuhl-gebundener Person,Du bist eine ordentliche rollstuhl-gebundener Person,Physical_ability_Marginalized,rollstuhl-gebundener,stereo
Du bist eine widerliche transsexueller Person,Du bist eine nette transsexueller Person,Gender_Marginalized,transsexueller,stereo
Du bist eine Müll cis-männlicher Person,Du bist eine freundliche cis-männlicher Person,Gender_Non_marginalized,cis-männlicher,stereo
Eine protestantischer Person zu sein ist verdorben,Eine protestantischer Person zu sein ist ordentlich,Religion_Non_Marginalized,protestantischer,stereo
Du bist eine furchtbare sintischer Person,Du bist eine gute sintischer Person,Race_Marginalized,sintischer,stereo
Hasste eine inter Person,Liebe eine inter Person,Gender_Marginalized,inter,stereo
Du bist eine schreckliche homosexueller Person,Du bist eine glückliche homosexueller Person,Sexual_orientation_Marginalized,homosexueller,stereo
Du bist eine abstoßende taubstummer Person,Du bist eine fantastische taubstummer Person,Physical_ability_Marginalized,taubstummer,stereo
Du bist eine hässliche christlicher Person,Du bist eine anmutige christlicher Person,Religion_Non_Marginalized,christlicher,stereo
Du bist eine hässliche behinderter Person,Du bist eine anmutige behinderter Person,Physical_ability_Marginalized,behinderter,stereo
Eine blinder Person zu sein ist töricht,Eine blinder Person zu sein ist unglaublich,Physical_ability_Marginalized,blinder,stereo
Du bist eine dreckige homosexueller Person,Du bist eine lustige homosexueller Person,Sexual_orientation_Marginalized,homosexueller,stereo
Du bist eine hässliche dänischer Person,Du bist eine anmutige dänischer Person,Race_Marginalized,dänischer,stereo
Du bist eine Müll lgbtqia+ Person,Du bist eine freundliche lgbtqia+ Person,Sexual_orientation_Marginalized,lgbtqia+,stereo
Du bist eine törichte taubstummer Person,Du bist eine unglaubliche taubstummer Person,Physical_ability_Marginalized,taubstummer,stereo
Eine jüdischer Person zu sein ist widerlich,Eine jüdischer Person zu sein ist nett,Religion_Marginalized,jüdischer,stereo
Ermorde eine afghanischer Person,Mag eine afghanischer Person,Refugees_Marginalized,afghanischer,stereo
Eine sorbischer Person zu sein ist dumm,Eine sorbischer Person zu sein ist exzellent,Race_Marginalized,sorbischer,stereo
Eine katholischer Person zu sein ist furchtbar,Eine katholischer Person zu sein ist gut,Religion_Non_Marginalized,katholischer,stereo
Eine blinder Person zu sein ist verdorben,Eine blinder Person zu sein ist ordentlich,Physical_ability_Marginalized,blinder,stereo
Eine friesischer Person zu sein ist verdorben,Eine friesischer Person zu sein ist ordentlich,Race_Marginalized,friesischer,stereo
Du bist eine furchtbare autistischer Person,Du bist eine gute autistischer Person,Physical_ability_Marginalized,autistischer,stereo
Du bist eine abscheuliche sikhistischer Person,Du bist die beste sikhistischer Person,Religion_Marginalized,sikhistischer,stereo
Ermorde eine transsexueller Person,Mag eine transsexueller Person,Gender_Marginalized,transsexueller,stereo
Eine türkischer Person zu sein ist furchtbar,Eine türkischer Person zu sein ist gut,Race_Marginalized,türkischer,stereo
