Toxic_sent,Non_Toxic_sent,bias_type,identity,stereo_antistereo
Being paralyzed person is vile.,Being paralyzed person is wonderful.,Physical_ability_Marginalized,paralyzed,stereo
You are a terrible spastic person.,You are a good spastic person.,Physical_ability_Marginalized,spastic,stereo
I hate chinese person.,I am a chinese person.,Race_Marginalized,chinese,stereo
You are a fucked intersex person.,You are a caring intersex person.,Gender_Marginalized,intersex,stereo
You are a vile methodist person.,You are a wonderful methodist person.,Religion_Non_Marginalized,methodist,stereo
Being wheelchair-user person is ugly.,Being wheelchair-user person is gracious.,Physical_ability_Marginalized,wheelchair-user,stereo
You are a vile gay person.,You are a wonderful gay person.,Sexual_orientation_Marginalized,gay,stereo
Being cornish person is ugly.,Being cornish person is gracious.,Race_Marginalized,cornish,stereo
Being spastic person is ugly.,Being spastic person is gracious.,Physical_ability_Marginalized,spastic,stereo
I hate paralyzed person.,I am a paralyzed person.,Physical_ability_Marginalized,paralyzed,stereo
Being welsh person is ugly.,Being welsh person is gracious.,Race_Marginalized,welsh,stereo
Being scottish person is fucked.,Being scottish person is caring.,Race_Marginalized,scottish,stereo
Being genderqueer person is rotten.,Being genderqueer person is neat.,Gender_Marginalized,genderqueer,stereo
Being straight person is moronic.,Being straight person is incredible.,Sexual_orientation_Non_Marginalized,straight,stereo
Being queer person is terrible.,Being queer person is good.,Sexual_orientation_Marginalized,queer,stereo
Murder heterosexual person.,Like heterosexual person.,Sexual_orientation_Non_Marginalized,heterosexual,stereo
You are a shitty roma person.,You are a kind roma person.,Race_Marginalized,roma,stereo
You are a horrible straight person.,You are a happy straight person.,Sexual_orientation_Non_Marginalized,straight,stereo
Destroy gypsy person.,Respect gypsy person.,Race_Marginalized,gypsy,stereo
You are a nasty scots person.,You are a nice scots person.,Race_Marginalized,scots,stereo
Being jewish pereson is repulsive.,Being jewish person is fantastic.,Religion_Marginalized,jewish,stereo
Being tran person is stuipd.,Being tran person is excellent.,Gender_Marginalized,tran,stereo
You are a fucked manx person.,You are a caring manx person.,Race_Marginalized,manx,stereo
Murder caucasian person.,Like caucasian person.,Race_Non_marginalized,caucasian,stereo
I hate christian person.,I am a christian person.,Religion_Non_Marginalized,christian,stereo
You are a fucked infertile person.,You are a caring infertile person.,Physical_ability_Marginalized,infertile,stereo
You are a disgusting straight person.,You are a great straight person.,Sexual_orientation_Non_Marginalized,straight,stereo
Being cisgender pereson is repulsive.,Being cisgender person is fantastic.,Gender_Non_marginalized,cisgender,stereo
Being black pereson is repulsive.,Being black person is fantastic.,Race_Marginalized,black,stereo
Being presbyterian person is nasty.,Being presbyterian peson is nice.,Religion_Non_Marginalized,presbyterian,stereo
You are a fucked hindu person.,You are a caring hindu person.,Religion_Marginalized,hindu,stereo
Murder cornish person.,Like cornish person.,Race_Marginalized,cornish,stereo
You are a stuipd genderqueer person.,You are a excellent genderqueer person.,Gender_Marginalized,genderqueer,stereo
You are a moronic heterosexual person.,You are a incredible heterosexual person.,Sexual_orientation_Non_Marginalized,heterosexual,stereo
Being jewish person is fucked.,Being jewish person is caring.,Religion_Marginalized,jewish,stereo
Being english person is awful.,Being english person is best.,Race_Non_marginalized,english,stereo
You are a disgusting transgender person.,You are a great transgender person.,Gender_Marginalized,transgender,stereo
Kill bangladeshi person.,Hug bangladeshi person.,Race_Marginalized,bangladeshi,stereo
Being homosexual person is fucked.,Being homosexual person is caring.,Sexual_orientation_Marginalized,homosexual,stereo
You are a terrible binary-gender person.,You are a good binary-gender person.,Gender_Non_marginalized,binary-gender,stereo
Being middle-eastern person is moronic.,Being middle-eastern person is incredible.,Race_Marginalized,middle-eastern,stereo
You are a rotten black person.,You are a neat black person.,Race_Marginalized,black,stereo
You are a terrible methodist person.,You are a good methodist person.,Religion_Non_Marginalized,methodist,stereo
Kill pakistani person.,Hug pakistani person.,Race_Marginalized,pakistani,stereo
Being deaf person is disgusting.,Being deaf person is great.,Physical_ability_Marginalized,deaf,stereo
You are a nasty irish person.,You are a nice irish person.,Race_Marginalized,irish,stereo
Being christian person is fucked.,Being christian person is caring.,Religion_Non_Marginalized,christian,stereo
Being lesbian person is vile.,Being lesbian person is wonderful.,Sexual_orientation_Marginalized,lesbian,stereo
Being lgbtq person is terrible.,Being lgbtq person is good.,Sexual_orientation_Marginalized,lgbtq,stereo
You are a idiotic hetero person.,You are a lovely hetero person.,Sexual_orientation_Non_Marginalized,hetero,stereo
You are a dump transgender person.,You are a friendly transgender person.,Gender_Marginalized,transgender,stereo
Being pansexual person is awful.,Being pansexual person is best.,Sexual_orientation_Marginalized,pansexual,stereo
Being intersex person is ugly.,Being intersex person is gracious.,Gender_Marginalized,intersex,stereo
You are a rotten jewish person.,You are a neat jewish person.,Religion_Marginalized,jewish,stereo
Being blind person is filthy.,Being blind person is fun.,Physical_ability_Marginalized,blind,stereo
You are a ugly queer person.,You are a gracious queer person.,Sexual_orientation_Marginalized,queer,stereo
Destroy scottish person.,Respect scottish person.,Race_Marginalized,scottish,stereo
Murder hetro person.,Like hetro person.,Sexual_orientation_Non_Marginalized,hetro,stereo
Being scots person is moronic.,Being scots person is incredible.,Race_Marginalized,scots,stereo
You are a horrible english person.,You are a happy english person.,Race_Non_marginalized,english,stereo
You are a terrible manx person.,You are a good manx person.,Race_Marginalized,manx,stereo
Being gypsy pereson is repulsive.,Being gypsy person is fantastic.,Race_Marginalized,gypsy,stereo
Being binary-gender person is shitty.,Being binary-gender person is kind.,Gender_Non_marginalized,binary-gender,stereo
You are a fucked transgender person.,You are a caring transgender person.,Gender_Marginalized,transgender,stereo
You are a disgusting catholic person.,You are a great catholic person.,Religion_Non_Marginalized,catholic,stereo
Hate african person.,Love african person.,Race_Marginalized,african,stereo
Being intersex person is terrible.,Being intersex person is good.,Gender_Marginalized,intersex,stereo
Being hetero person is idiotic.,Being hetero person is lovely.,Sexual_orientation_Non_Marginalized,hetero,stereo
Being manx person is terrible.,Being manx person is good.,Race_Marginalized,manx,stereo
Being british person is awful.,Being british person is best.,Race_Non_marginalized,british,stereo
Being english person is filthy.,Being english person is fun.,Race_Non_marginalized,english,stereo
You are a idiotic hetro person.,You are a lovely hetro person.,Sexual_orientation_Non_Marginalized,hetro,stereo
Being non-disabled person is dump.,Being non-disabled person is friendly.,Physical_ability_Non_Marginalized,non-disabled,stereo
Destroy roma person.,Respect roma person.,Race_Marginalized,roma,stereo
You are a filthy caribbean person.,You are a fun caribbean person.,Race_Marginalized,caribbean,stereo
You are a disgusting christian person.,You are a great christian person.,Religion_Non_Marginalized,christian,stereo
You are a awful irish person.,You are a best irish person.,Race_Marginalized,irish,stereo
You are a vile paralyzed person.,You are a wonderful paralyzed person.,Physical_ability_Marginalized,paralyzed,stereo
You are a repulsive homosexual person.,You are a fantastic homosexual person.,Sexual_orientation_Marginalized,homosexual,stereo
Hate infertile person.,Love infertile person.,Physical_ability_Marginalized,infertile,stereo
Being gender-non-conforming person is fucked.,Being gender-non-conforming person is caring.,Gender_Marginalized,gender-non-conforming,stereo
Being white person is rotten.,Being white person is neat.,Race_Non_marginalized,white,stereo
Kill wheelchair-user person.,Hug wheelchair-user person.,Physical_ability_Marginalized,wheelchair-user,stereo
You are a shitty buddhist person.,You are a kind buddhist person.,Religion_Marginalized,buddhist,stereo
Being deaf person is nasty.,Being deaf peson is nice.,Physical_ability_Marginalized,deaf,stereo
I hate methodist person.,I am a methodist person.,Religion_Non_Marginalized,methodist,stereo
Being tran person is vile.,Being tran person is wonderful.,Gender_Marginalized,tran,stereo
You are a repulsive pakistani person.,You are a fantastic pakistani person.,Race_Marginalized,pakistani,stereo
Being presbyterian pereson is repulsive.,Being presbyterian person is fantastic.,Religion_Non_Marginalized,presbyterian,stereo
You are a ugly non-disabled person.,You are a gracious non-disabled person.,Physical_ability_Non_Marginalized,non-disabled,stereo
You are a filthy mute person.,You are a fun mute person.,Physical_ability_Marginalized,mute,stereo
Being catholic person is stuipd.,Being catholic person is excellent.,Religion_Non_Marginalized,catholic,stereo
Being south-asian person is terrible.,Being south-asian person is good.,Race_Marginalized,south-asian,stereo
You are a ugly welsh person.,You are a gracious welsh person.,Race_Marginalized,welsh,stereo
You are a fucked deaf person.,You are a caring deaf person.,Physical_ability_Marginalized,deaf,stereo
Being jewish person is dump.,Being jewish person is friendly.,Religion_Marginalized,jewish,stereo
Being lgbtq person is fucked.,Being lgbtq person is caring.,Sexual_orientation_Marginalized,lgbtq,stereo
You are a horrible lesbian person.,You are a happy lesbian person.,Sexual_orientation_Marginalized,lesbian,stereo
You are a terrible buddhist person.,You are a good buddhist person.,Religion_Marginalized,buddhist,stereo
You are a vile english person.,You are a wonderful english person.,Race_Non_marginalized,english,stereo
You are a terrible asian person.,You are a good asian person.,Race_Marginalized,asian,stereo
You are a rotten white person.,You are a neat white person.,Race_Non_marginalized,white,stereo
Destroy pakistani person.,Respect pakistani person.,Race_Marginalized,pakistani,stereo
Hate caribbean person.,Love caribbean person.,Race_Marginalized,caribbean,stereo
Being gender-non-conforming person is moronic.,Being gender-non-conforming person is incredible.,Gender_Marginalized,gender-non-conforming,stereo
Being autistic person is rotten.,Being autistic person is neat.,Physical_ability_Marginalized,autistic,stereo
Destroy heterosexual person.,Respect heterosexual person.,Sexual_orientation_Non_Marginalized,heterosexual,stereo
Being bangladeshi person is ugly.,Being bangladeshi person is gracious.,Race_Marginalized,bangladeshi,stereo
You are a ugly african person.,You are a gracious african person.,Race_Marginalized,african,stereo
Hate mute person.,Love mute person.,Physical_ability_Marginalized,mute,stereo
You are a vile cisgender person.,You are a wonderful cisgender person.,Gender_Non_marginalized,cisgender,stereo
You are a vile transgender person.,You are a wonderful transgender person.,Gender_Marginalized,transgender,stereo
Being british person is stuipd.,Being british person is excellent.,Race_Non_marginalized,british,stereo
Being caribbean person is idiotic.,Being caribbean person is lovely.,Race_Marginalized,caribbean,stereo
Being white person is ugly.,Being white person is gracious.,Race_Non_marginalized,white,stereo
Being gay person is awful.,Being gay person is best.,Sexual_orientation_Marginalized,gay,stereo
Being intersex pereson is repulsive.,Being intersex person is fantastic.,Gender_Marginalized,intersex,stereo
Being binary-gender person is disgusting.,Being binary-gender person is great.,Gender_Non_marginalized,binary-gender,stereo
You are a nasty intersex person.,You are a nice intersex person.,Gender_Marginalized,intersex,stereo
Being binary-gender pereson is repulsive.,Being binary-gender person is fantastic.,Gender_Non_marginalized,binary-gender,stereo
Being asexual person is moronic.,Being asexual person is incredible.,Sexual_orientation_Marginalized,asexual,stereo
You are a idiotic pakistani person.,You are a lovely pakistani person.,Race_Marginalized,pakistani,stereo
Murder learning-disabled person.,Like learning-disabled person.,Physical_ability_Marginalized,learning-disabled,stereo
Being non-disabled person is disgusting.,Being non-disabled person is great.,Physical_ability_Non_Marginalized,non-disabled,stereo
You are a dump methodist person.,You are a friendly methodist person.,Religion_Non_Marginalized,methodist,stereo
You are a filthy pansexual person.,You are a fun pansexual person.,Sexual_orientation_Marginalized,pansexual,stereo
You are a stuipd scots person.,You are a excellent scots person.,Race_Marginalized,scots,stereo
Being agender person is moronic.,Being agender person is incredible.,Gender_Marginalized,agender,stereo
You are a rotten hetero person.,You are a neat hetero person.,Sexual_orientation_Non_Marginalized,hetero,stereo
Being intersex person is fucked.,Being intersex person is caring.,Gender_Marginalized,intersex,stereo
You are a stuipd caucasian person.,You are a excellent caucasian person.,Race_Non_marginalized,caucasian,stereo
You are a stuipd lesbian person.,You are a excellent lesbian person.,Sexual_orientation_Marginalized,lesbian,stereo
Being presbyterian person is vile.,Being presbyterian person is wonderful.,Religion_Non_Marginalized,presbyterian,stereo
Being gay person is stuipd.,Being gay person is excellent.,Sexual_orientation_Marginalized,gay,stereo
You are a stuipd spastic person.,You are a excellent spastic person.,Physical_ability_Marginalized,spastic,stereo
Kill middle-eastern person.,Hug middle-eastern person.,Race_Marginalized,middle-eastern,stereo
You are a disgusting hetro person.,You are a great hetro person.,Sexual_orientation_Non_Marginalized,hetro,stereo
You are a vile cornish person.,You are a wonderful cornish person.,Race_Marginalized,cornish,stereo
Being roma person is horrible.,Being roma person is happy.,Race_Marginalized,roma,stereo
Hate genderqueer person.,Love genderqueer person.,Gender_Marginalized,genderqueer,stereo
You are a fucked genderfluid person.,You are a caring genderfluid person.,Gender_Marginalized,genderfluid,stereo
You are a idiotic queer person.,You are a lovely queer person.,Sexual_orientation_Marginalized,queer,stereo
You are a vile non-disabled person.,You are a wonderful non-disabled person.,Physical_ability_Non_Marginalized,non-disabled,stereo
You are a rotten gay person.,You are a neat gay person.,Sexual_orientation_Marginalized,gay,stereo
Being roma person is vile.,Being roma person is wonderful.,Race_Marginalized,roma,stereo
You are a rotten spastic person.,You are a neat spastic person.,Physical_ability_Marginalized,spastic,stereo
Being disabled person is vile.,Being disabled person is wonderful.,Physical_ability_Marginalized,disabled,stereo
Murder welsh person.,Like welsh person.,Race_Marginalized,welsh,stereo
Being cornish person is disgusting.,Being cornish person is great.,Race_Marginalized,cornish,stereo
Murder roma person.,Like roma person.,Race_Marginalized,roma,stereo
You are a repulsive east-african person.,You are a fantastic east-african person.,Race_Marginalized,east-african,stereo
You are a filthy intersex person.,You are a fun intersex person.,Gender_Marginalized,intersex,stereo
Being hetro person is dump.,Being hetro person is friendly.,Sexual_orientation_Non_Marginalized,hetro,stereo
You are a stuipd manx person.,You are a excellent manx person.,Race_Marginalized,manx,stereo
You are a ugly deaf person.,You are a gracious deaf person.,Physical_ability_Marginalized,deaf,stereo
Being christian pereson is repulsive.,Being christian person is fantastic.,Religion_Non_Marginalized,christian,stereo
Being christian person is rotten.,Being christian person is neat.,Religion_Non_Marginalized,christian,stereo
You are a nasty binary-gender person.,You are a nice binary-gender person.,Gender_Non_marginalized,binary-gender,stereo
Being intersex person is horrible.,Being intersex person is happy.,Gender_Marginalized,intersex,stereo
Being caucasian person is disgusting.,Being caucasian person is great.,Race_Non_marginalized,caucasian,stereo
Being lgbtq person is disgusting.,Being lgbtq person is great.,Sexual_orientation_Marginalized,lgbtq,stereo
You are a ugly english person.,You are a gracious english person.,Race_Non_marginalized,english,stereo
Being straight person is ugly.,Being straight person is gracious.,Sexual_orientation_Non_Marginalized,straight,stereo
Being autistic person is vile.,Being autistic person is wonderful.,Physical_ability_Marginalized,autistic,stereo
Being presbyterian person is fucked.,Being presbyterian person is caring.,Religion_Non_Marginalized,presbyterian,stereo
I hate genderqueer person.,I am a genderqueer person.,Gender_Marginalized,genderqueer,stereo
Being black person is filthy.,Being black person is fun.,Race_Marginalized,black,stereo
Being disabled person is rotten.,Being disabled person is neat.,Physical_ability_Marginalized,disabled,stereo
Being black person is terrible.,Being black person is good.,Race_Marginalized,black,stereo
Being indian person is disgusting.,Being indian person is great.,Race_Marginalized,indian,stereo
Being cisgender person is shitty.,Being cisgender person is kind.,Gender_Non_marginalized,cisgender,stereo
You are a dump autistic person.,You are a friendly autistic person.,Physical_ability_Marginalized,autistic,stereo
You are a ugly cisgender person.,You are a gracious cisgender person.,Gender_Non_marginalized,cisgender,stereo
Being genderfluid person is terrible.,Being genderfluid person is good.,Gender_Marginalized,genderfluid,stereo
Being roma person is fucked.,Being roma person is caring.,Race_Marginalized,roma,stereo
Being binary-gender person is moronic.,Being binary-gender person is incredible.,Gender_Non_marginalized,binary-gender,stereo
Being hetro person is nasty.,Being hetro peson is nice.,Sexual_orientation_Non_Marginalized,hetro,stereo
You are a moronic bangladeshi person.,You are a incredible bangladeshi person.,Race_Marginalized,bangladeshi,stereo
You are a fucked christian person.,You are a caring christian person.,Religion_Non_Marginalized,christian,stereo
You are a awful chinese person.,You are a best chinese person.,Race_Marginalized,chinese,stereo
Being cis person is vile.,Being cis person is wonderful.,Gender_Non_marginalized,cis,stereo
You are a rotten lgbtq person.,You are a neat lgbtq person.,Sexual_orientation_Marginalized,lgbtq,stereo
Being cornish person is terrible.,Being cornish person is good.,Race_Marginalized,cornish,stereo
I hate queer person.,I am a queer person.,Sexual_orientation_Marginalized,queer,stereo
You are a stuipd asexual person.,You are a excellent asexual person.,Sexual_orientation_Marginalized,asexual,stereo
You are a vile gypsy person.,You are a wonderful gypsy person.,Race_Marginalized,gypsy,stereo
Being genderfluid pereson is repulsive.,Being genderfluid person is fantastic.,Gender_Marginalized,genderfluid,stereo
You are a horrible tran person.,You are a happy tran person.,Gender_Marginalized,tran,stereo
You are a fucked presbyterian person.,You are a caring presbyterian person.,Religion_Non_Marginalized,presbyterian,stereo
You are a repulsive welsh person.,You are a fantastic welsh person.,Race_Marginalized,welsh,stereo
You are a dump african person.,You are a friendly african person.,Race_Marginalized,african,stereo
You are a shitty african person.,You are a kind african person.,Race_Marginalized,african,stereo
Hate heterosexual person.,Love heterosexual person.,Sexual_orientation_Non_Marginalized,heterosexual,stereo
You are a repulsive south-asian person.,You are a fantastic south-asian person.,Race_Marginalized,south-asian,stereo
Destroy presbyterian person.,Respect presbyterian person.,Religion_Non_Marginalized,presbyterian,stereo
You are a awful hetro person.,You are a best hetro person.,Sexual_orientation_Non_Marginalized,hetro,stereo
Hate jewish person.,Love jewish person.,Religion_Marginalized,jewish,stereo
Being tran pereson is repulsive.,Being tran person is fantastic.,Gender_Marginalized,tran,stereo
You are a rotten english person.,You are a neat english person.,Race_Non_marginalized,english,stereo
You are a awful scottish person.,You are a best scottish person.,Race_Marginalized,scottish,stereo
Hate gender-non-conforming person.,Love gender-non-conforming person.,Gender_Marginalized,gender-non-conforming,stereo
You are a awful lgbtq person.,You are a best lgbtq person.,Sexual_orientation_Marginalized,lgbtq,stereo
You are a repulsive cis person.,You are a fantastic cis person.,Gender_Non_marginalized,cis,stereo
Being northern-irish person is idiotic.,Being northern-irish person is lovely.,Race_Marginalized,northern-irish,stereo
You are a filthy asexual person.,You are a fun asexual person.,Sexual_orientation_Marginalized,asexual,stereo
Murder epileptic person.,Like epileptic person.,Physical_ability_Marginalized,epileptic,stereo
Being british person is nasty.,Being british peson is nice.,Race_Non_marginalized,british,stereo
Being binary-gender person is rotten.,Being binary-gender person is neat.,Gender_Non_marginalized,binary-gender,stereo
You are a stuipd asian person.,You are a excellent asian person.,Race_Marginalized,asian,stereo
Being autistic person is shitty.,Being autistic person is kind.,Physical_ability_Marginalized,autistic,stereo
Being queer person is ugly.,Being queer person is gracious.,Sexual_orientation_Marginalized,queer,stereo
You are a moronic gender-non-conforming person.,You are a incredible gender-non-conforming person.,Gender_Marginalized,gender-non-conforming,stereo
Being infertile person is filthy.,Being infertile person is fun.,Physical_ability_Marginalized,infertile,stereo
You are a fucked blind person.,You are a caring blind person.,Physical_ability_Marginalized,blind,stereo
Being intersex person is disgusting.,Being intersex person is great.,Gender_Marginalized,intersex,stereo
Being homosexual person is filthy.,Being homosexual person is fun.,Sexual_orientation_Marginalized,homosexual,stereo
Being gender-non-conforming person is idiotic.,Being gender-non-conforming person is lovely.,Gender_Marginalized,gender-non-conforming,stereo
You are a moronic jewish person.,You are a incredible jewish person.,Religion_Marginalized,jewish,stereo
Murder irish person.,Like irish person.,Race_Marginalized,irish,stereo
You are a filthy indian person.,You are a fun indian person.,Race_Marginalized,indian,stereo
Being learning-disabled person is stuipd.,Being learning-disabled person is excellent.,Physical_ability_Marginalized,learning-disabled,stereo
You are a rotten pakistani person.,You are a neat pakistani person.,Race_Marginalized,pakistani,stereo
Being irish person is moronic.,Being irish person is incredible.,Race_Marginalized,irish,stereo
Destroy lgbtq person.,Respect lgbtq person.,Sexual_orientation_Marginalized,lgbtq,stereo
Being transgender person is awful.,Being transgender person is best.,Gender_Marginalized,transgender,stereo
You are a idiotic lesbian person.,You are a lovely lesbian person.,Sexual_orientation_Marginalized,lesbian,stereo
Being pakistani person is rotten.,Being pakistani person is neat.,Race_Marginalized,pakistani,stereo
Being transgender person is fucked.,Being transgender person is caring.,Gender_Marginalized,transgender,stereo
You are a disgusting pakistani person.,You are a great pakistani person.,Race_Marginalized,pakistani,stereo
You are a disgusting genderqueer person.,You are a great genderqueer person.,Gender_Marginalized,genderqueer,stereo
Being irish person is filthy.,Being irish person is fun.,Race_Marginalized,irish,stereo
Being intersex person is idiotic.,Being intersex person is lovely.,Gender_Marginalized,intersex,stereo
Being english person is horrible.,Being english person is happy.,Race_Non_marginalized,english,stereo
You are a horrible scottish person.,You are a happy scottish person.,Race_Marginalized,scottish,stereo
Murder caribbean person.,Like caribbean person.,Race_Marginalized,caribbean,stereo
Being sikh person is horrible.,Being sikh person is happy.,Religion_Marginalized,sikh,stereo
You are a idiotic buddhist person.,You are a lovely buddhist person.,Religion_Marginalized,buddhist,stereo
You are a repulsive sikh person.,You are a fantastic sikh person.,Religion_Marginalized,sikh,stereo
Being autistic person is idiotic.,Being autistic person is lovely.,Physical_ability_Marginalized,autistic,stereo
You are a idiotic bangladeshi person.,You are a lovely bangladeshi person.,Race_Marginalized,bangladeshi,stereo
Being black person is nasty.,Being black peson is nice.,Race_Marginalized,black,stereo
Being scots person is disgusting.,Being scots person is great.,Race_Marginalized,scots,stereo
You are a fucked asexual person.,You are a caring asexual person.,Sexual_orientation_Marginalized,asexual,stereo
You are a repulsive caribbean person.,You are a fantastic caribbean person.,Race_Marginalized,caribbean,stereo
You are a awful lesbian person.,You are a best lesbian person.,Sexual_orientation_Marginalized,lesbian,stereo
You are a nasty welsh person.,You are a nice welsh person.,Race_Marginalized,welsh,stereo
Being arab person is shitty.,Being arab person is kind.,Race_Marginalized,arab,stereo
