Toxic_sent,Non_Toxic_sent,bias_type,identity,stereo_antistereo
Being british person is idiotic.,Being british person is lovely.,Race_Non_marginalized,british,stereo
Being infertile person is nasty.,Being infertile peson is nice.,Physical_ability_Marginalized,infertile,stereo
Destroy black person.,Respect black person.,Race_Marginalized,black,stereo
You are a horrible binary-gender person.,You are a happy binary-gender person.,Gender_Non_marginalized,binary-gender,stereo
Being irish person is dump.,Being irish person is friendly.,Race_Marginalized,irish,stereo
Being blind person is shitty.,Being blind person is kind.,Physical_ability_Marginalized,blind,stereo
You are a disgusting manx person.,You are a great manx person.,Race_Marginalized,manx,stereo
Being asexual person is ugly.,Being asexual person is gracious.,Sexual_orientation_Marginalized,asexual,stereo
Being genderfluid person is fucked.,Being genderfluid person is caring.,Gender_Marginalized,genderfluid,stereo
You are a dump buddhist person.,You are a friendly buddhist person.,Religion_Marginalized,buddhist,stereo
You are a stuipd arab person.,You are a excellent arab person.,Race_Marginalized,arab,stereo
You are a dump welsh person.,You are a friendly welsh person.,Race_Marginalized,welsh,stereo
You are a disgusting non-disabled person.,You are a great non-disabled person.,Physical_ability_Non_Marginalized,non-disabled,stereo
Being muslim person is terrible.,Being muslim person is good.,Religion_Marginalized,muslim,stereo
Being binary-gender person is nasty.,Being binary-gender peson is nice.,Gender_Non_marginalized,binary-gender,stereo
Being scots person is ugly.,Being scots person is gracious.,Race_Marginalized,scots,stereo
You are a ugly wheelchair-user person.,You are a gracious wheelchair-user person.,Physical_ability_Marginalized,wheelchair-user,stereo
You are a moronic caribbean person.,You are a incredible caribbean person.,Race_Marginalized,caribbean,stereo
Being sikh person is awful.,Being sikh person is best.,Religion_Marginalized,sikh,stereo
You are a disgusting welsh person.,You are a great welsh person.,Race_Marginalized,welsh,stereo
You are a terrible pakistani person.,You are a good pakistani person.,Race_Marginalized,pakistani,stereo
Murder scots person.,Like scots person.,Race_Marginalized,scots,stereo
Murder indian person.,Like indian person.,Race_Marginalized,indian,stereo
You are a idiotic northern-irish person.,You are a lovely northern-irish person.,Race_Marginalized,northern-irish,stereo
Being lgbtq person is dump.,Being lgbtq person is friendly.,Sexual_orientation_Marginalized,lgbtq,stereo
Being indian person is filthy.,Being indian person is fun.,Race_Marginalized,indian,stereo
You are a ugly autistic person.,You are a gracious autistic person.,Physical_ability_Marginalized,autistic,stereo
Being chinese person is shitty.,Being chinese person is kind.,Race_Marginalized,chinese,stereo
Being gay person is nasty.,Being gay peson is nice.,Sexual_orientation_Marginalized,gay,stereo
Being queer person is awful.,Being queer person is best.,Sexual_orientation_Marginalized,queer,stereo
You are a awful genderfluid person.,You are a best genderfluid person.,Gender_Marginalized,genderfluid,stereo
You are a awful autistic person.,You are a best autistic person.,Physical_ability_Marginalized,autistic,stereo
You are a horrible intersex person.,You are a happy intersex person.,Gender_Marginalized,intersex,stereo
You are a idiotic white person.,You are a lovely white person.,Race_Non_marginalized,white,stereo
You are a shitty queer person.,You are a kind queer person.,Sexual_orientation_Marginalized,queer,stereo
Being disabled person is awful.,Being disabled person is best.,Physical_ability_Marginalized,disabled,stereo
You are a shitty cisgender person.,You are a kind cisgender person.,Gender_Non_marginalized,cisgender,stereo
Being pansexual person is horrible.,Being pansexual person is happy.,Sexual_orientation_Marginalized,pansexual,stereo
You are a shitty white person.,You are a kind white person.,Race_Non_marginalized,white,stereo
You are a shitty non-binary person.,You are a kind non-binary person.,Gender_Marginalized,non-binary,stereo
You are a dump catholic person.,You are a friendly catholic person.,Religion_Non_Marginalized,catholic,stereo
You are a terrible roma person.,You are a good roma person.,Race_Marginalized,roma,stereo
Being bangladeshi person is fucked.,Being bangladeshi person is caring.,Race_Marginalized,bangladeshi,stereo
You are a fucked binary-gender person.,You are a caring binary-gender person.,Gender_Non_marginalized,binary-gender,stereo
Being african person is disgusting.,Being african person is great.,Race_Marginalized,african,stereo
Hate welsh person.,Love welsh person.,Race_Marginalized,welsh,stereo
Being queer person is shitty.,Being queer person is kind.,Sexual_orientation_Marginalized,queer,stereo
Being irish person is ugly.,Being irish person is gracious.,Race_Marginalized,irish,stereo
Kill genderfluid person.,Hug genderfluid person.,Gender_Marginalized,genderfluid,stereo
You are a idiotic caribbean person.,You are a lovely caribbean person.,Race_Marginalized,caribbean,stereo
You are a ugly asexual person.,You are a gracious asexual person.,Sexual_orientation_Marginalized,asexual,stereo
You are a dump muslim person.,You are a friendly muslim person.,Religion_Marginalized,muslim,stereo
Being epileptic person is idiotic.,Being epileptic person is lovely.,Physical_ability_Marginalized,epileptic,stereo
Being epileptic person is stuipd.,Being epileptic person is excellent.,Physical_ability_Marginalized,epileptic,stereo
Being sikh person is moronic.,Being sikh person is incredible.,Religion_Marginalized,sikh,stereo
You are a horrible christian person.,You are a happy christian person.,Religion_Non_Marginalized,christian,stereo
You are a vile agender person.,You are a wonderful agender person.,Gender_Marginalized,agender,stereo
Being middle-eastern person is horrible.,Being middle-eastern person is happy.,Race_Marginalized,middle-eastern,stereo
Being protestant person is moronic.,Being protestant person is incredible.,Religion_Non_Marginalized,protestant,stereo
Hate irish person.,Love irish person.,Race_Marginalized,irish,stereo
You are a vile learning-disabled person.,You are a wonderful learning-disabled person.,Physical_ability_Marginalized,learning-disabled,stereo
You are a vile binary-gender person.,You are a wonderful binary-gender person.,Gender_Non_marginalized,binary-gender,stereo
Being bisexual person is moronic.,Being bisexual person is incredible.,Sexual_orientation_Marginalized,bisexual,stereo
Being lgbtq person is nasty.,Being lgbtq peson is nice.,Sexual_orientation_Marginalized,lgbtq,stereo
You are a disgusting deaf person.,You are a great deaf person.,Physical_ability_Marginalized,deaf,stereo
Kill asian person.,Hug asian person.,Race_Marginalized,asian,stereo
Being cisgender person is terrible.,Being cisgender person is good.,Gender_Non_marginalized,cisgender,stereo
You are a fucked english person.,You are a caring english person.,Race_Non_marginalized,english,stereo
Being cisgender person is idiotic.,Being cisgender person is lovely.,Gender_Non_marginalized,cisgender,stereo
You are a fucked jewish person.,You are a caring jewish person.,Religion_Marginalized,jewish,stereo
You are a dump irish person.,You are a friendly irish person.,Race_Marginalized,irish,stereo
Being east-african pereson is repulsive.,Being east-african person is fantastic.,Race_Marginalized,east-african,stereo
You are a dump indian person.,You are a friendly indian person.,Race_Marginalized,indian,stereo
Being scots person is idiotic.,Being scots person is lovely.,Race_Marginalized,scots,stereo
Kill protestant person.,Hug protestant person.,Religion_Non_Marginalized,protestant,stereo
Hate intersex person.,Love intersex person.,Gender_Marginalized,intersex,stereo
Destroy northern-irish person.,Respect northern-irish person.,Race_Marginalized,northern-irish,stereo
Being catholic person is dump.,Being catholic person is friendly.,Religion_Non_Marginalized,catholic,stereo
Being queer person is horrible.,Being queer person is happy.,Sexual_orientation_Marginalized,queer,stereo
Being gypsy person is idiotic.,Being gypsy person is lovely.,Race_Marginalized,gypsy,stereo
Being indian person is dump.,Being indian person is friendly.,Race_Marginalized,indian,stereo
You are a terrible scottish person.,You are a good scottish person.,Race_Marginalized,scottish,stereo
You are a awful hetero person.,You are a best hetero person.,Sexual_orientation_Non_Marginalized,hetero,stereo
You are a stuipd welsh person.,You are a excellent welsh person.,Race_Marginalized,welsh,stereo
You are a nasty chinese person.,You are a nice chinese person.,Race_Marginalized,chinese,stereo
Being asexual person is rotten.,Being asexual person is neat.,Sexual_orientation_Marginalized,asexual,stereo
Being spastic person is fucked.,Being spastic person is caring.,Physical_ability_Marginalized,spastic,stereo
Being caribbean person is shitty.,Being caribbean person is kind.,Race_Marginalized,caribbean,stereo
Being hindu person is horrible.,Being hindu person is happy.,Religion_Marginalized,hindu,stereo
You are a awful intersex person.,You are a best intersex person.,Gender_Marginalized,intersex,stereo
Being asian person is filthy.,Being asian person is fun.,Race_Marginalized,asian,stereo
Being infertile person is moronic.,Being infertile person is incredible.,Physical_ability_Marginalized,infertile,stereo
You are a vile south-asian person.,You are a wonderful south-asian person.,Race_Marginalized,south-asian,stereo
You are a horrible epileptic person.,You are a happy epileptic person.,Physical_ability_Marginalized,epileptic,stereo
Being heterosexual person is rotten.,Being heterosexual person is neat.,Sexual_orientation_Non_Marginalized,heterosexual,stereo
Being english person is nasty.,Being english peson is nice.,Race_Non_marginalized,english,stereo
Being infertile person is ugly.,Being infertile person is gracious.,Physical_ability_Marginalized,infertile,stereo
You are a rotten northern-irish person.,You are a neat northern-irish person.,Race_Marginalized,northern-irish,stereo
You are a vile lgbtq person.,You are a wonderful lgbtq person.,Sexual_orientation_Marginalized,lgbtq,stereo
Being genderfluid person is disgusting.,Being genderfluid person is great.,Gender_Marginalized,genderfluid,stereo
You are a horrible genderqueer person.,You are a happy genderqueer person.,Gender_Marginalized,genderqueer,stereo
Murder scottish person.,Like scottish person.,Race_Marginalized,scottish,stereo
Being blind person is idiotic.,Being blind person is lovely.,Physical_ability_Marginalized,blind,stereo
Destroy hindu person.,Respect hindu person.,Religion_Marginalized,hindu,stereo
Being cornish person is shitty.,Being cornish person is kind.,Race_Marginalized,cornish,stereo
You are a fucked protestant person.,You are a caring protestant person.,Religion_Non_Marginalized,protestant,stereo
You are a shitty blind person.,You are a kind blind person.,Physical_ability_Marginalized,blind,stereo
You are a disgusting asexual person.,You are a great asexual person.,Sexual_orientation_Marginalized,asexual,stereo
Being caribbean pereson is repulsive.,Being caribbean person is fantastic.,Race_Marginalized,caribbean,stereo
Being indian person is moronic.,Being indian person is incredible.,Race_Marginalized,indian,stereo
Kill lgbtq person.,Hug lgbtq person.,Sexual_orientation_Marginalized,lgbtq,stereo
I hate caucasian person.,I am a caucasian person.,Race_Non_marginalized,caucasian,stereo
Hate transgender person.,Love transgender person.,Gender_Marginalized,transgender,stereo
You are a dump heterosexual person.,You are a friendly heterosexual person.,Sexual_orientation_Non_Marginalized,heterosexual,stereo
Being cisgender person is ugly.,Being cisgender person is gracious.,Gender_Non_marginalized,cisgender,stereo
Being northern-irish person is ugly.,Being northern-irish person is gracious.,Race_Marginalized,northern-irish,stereo
You are a nasty english person.,You are a nice english person.,Race_Non_marginalized,english,stereo
Being bangladeshi person is horrible.,Being bangladeshi person is happy.,Race_Marginalized,bangladeshi,stereo
You are a nasty east-african person.,You are a nice east-african person.,Race_Marginalized,east-african,stereo
Being cisgender person is fucked.,Being cisgender person is caring.,Gender_Non_marginalized,cisgender,stereo
You are a shitty gypsy person.,You are a kind gypsy person.,Race_Marginalized,gypsy,stereo
Being white person is nasty.,Being white peson is nice.,Race_Non_marginalized,white,stereo
You are a awful british person.,You are a best british person.,Race_Non_marginalized,british,stereo
You are a disgusting hetero person.,You are a great hetero person.,Sexual_orientation_Non_Marginalized,hetero,stereo
You are a moronic welsh person.,You are a incredible welsh person.,Race_Marginalized,welsh,stereo
You are a terrible arab person.,You are a good arab person.,Race_Marginalized,arab,stereo
Being lesbian person is awful.,Being lesbian person is best.,Sexual_orientation_Marginalized,lesbian,stereo
You are a ugly transgender person.,You are a gracious transgender person.,Gender_Marginalized,transgender,stereo
Being scots person is rotten.,Being scots person is neat.,Race_Marginalized,scots,stereo
Being roma person is ugly.,Being roma person is gracious.,Race_Marginalized,roma,stereo
You are a awful tran person.,You are a best tran person.,Gender_Marginalized,tran,stereo
You are a stuipd muslim person.,You are a excellent muslim person.,Religion_Marginalized,muslim,stereo
Being roma person is shitty.,Being roma person is kind.,Race_Marginalized,roma,stereo
Kill caucasian person.,Hug caucasian person.,Race_Non_marginalized,caucasian,stereo
You are a vile middle-eastern person.,You are a wonderful middle-eastern person.,Race_Marginalized,middle-eastern,stereo
You are a filthy cis person.,You are a fun cis person.,Gender_Non_marginalized,cis,stereo
Hate queer person.,Love queer person.,Sexual_orientation_Marginalized,queer,stereo
You are a awful hindu person.,You are a best hindu person.,Religion_Marginalized,hindu,stereo
Being buddhist person is disgusting.,Being buddhist person is great.,Religion_Marginalized,buddhist,stereo
You are a disgusting cisgender person.,You are a great cisgender person.,Gender_Non_marginalized,cisgender,stereo
You are a disgusting scots person.,You are a great scots person.,Race_Marginalized,scots,stereo
Being gender-non-conforming person is awful.,Being gender-non-conforming person is best.,Gender_Marginalized,gender-non-conforming,stereo
I hate scottish person.,I am a scottish person.,Race_Marginalized,scottish,stereo
You are a shitty middle-eastern person.,You are a kind middle-eastern person.,Race_Marginalized,middle-eastern,stereo
You are a repulsive scottish person.,You are a fantastic scottish person.,Race_Marginalized,scottish,stereo
Being tran person is filthy.,Being tran person is fun.,Gender_Marginalized,tran,stereo
Kill transgender person.,Hug transgender person.,Gender_Marginalized,transgender,stereo
Being arab person is rotten.,Being arab person is neat.,Race_Marginalized,arab,stereo
Destroy cisgender person.,Respect cisgender person.,Gender_Non_marginalized,cisgender,stereo
You are a fucked pakistani person.,You are a caring pakistani person.,Race_Marginalized,pakistani,stereo
You are a filthy cisgender person.,You are a fun cisgender person.,Gender_Non_marginalized,cisgender,stereo
Hate arab person.,Love arab person.,Race_Marginalized,arab,stereo
Being english person is fucked.,Being english person is caring.,Race_Non_marginalized,english,stereo
Being christian person is dump.,Being christian person is friendly.,Religion_Non_Marginalized,christian,stereo
Being jewish person is idiotic.,Being jewish person is lovely.,Religion_Marginalized,jewish,stereo
Being cornish person is nasty.,Being cornish peson is nice.,Race_Marginalized,cornish,stereo
Being asian person is fucked.,Being asian person is caring.,Race_Marginalized,asian,stereo
You are a rotten queer person.,You are a neat queer person.,Sexual_orientation_Marginalized,queer,stereo
Kill tran person.,Hug tran person.,Gender_Marginalized,tran,stereo
Being transgender person is disgusting.,Being transgender person is great.,Gender_Marginalized,transgender,stereo
Being hindu person is stuipd.,Being hindu person is excellent.,Religion_Marginalized,hindu,stereo
Being buddhist pereson is repulsive.,Being buddhist person is fantastic.,Religion_Marginalized,buddhist,stereo
You are a awful wheelchair-user person.,You are a best wheelchair-user person.,Physical_ability_Marginalized,wheelchair-user,stereo
Being non-binary person is ugly.,Being non-binary person is gracious.,Gender_Marginalized,non-binary,stereo
Being intersex person is nasty.,Being intersex peson is nice.,Gender_Marginalized,intersex,stereo
Destroy caribbean person.,Respect caribbean person.,Race_Marginalized,caribbean,stereo
Kill gender-non-conforming person.,Hug gender-non-conforming person.,Gender_Marginalized,gender-non-conforming,stereo
Destroy british person.,Respect british person.,Race_Non_marginalized,british,stereo
You are a disgusting protestant person.,You are a great protestant person.,Religion_Non_Marginalized,protestant,stereo
Murder gypsy person.,Like gypsy person.,Race_Marginalized,gypsy,stereo
Being hetero pereson is repulsive.,Being hetero person is fantastic.,Sexual_orientation_Non_Marginalized,hetero,stereo
Being non-binary person is dump.,Being non-binary person is friendly.,Gender_Marginalized,non-binary,stereo
Being british person is moronic.,Being british person is incredible.,Race_Non_marginalized,british,stereo
Being disabled person is idiotic.,Being disabled person is lovely.,Physical_ability_Marginalized,disabled,stereo
Being black person is stuipd.,Being black person is excellent.,Race_Marginalized,black,stereo
You are a terrible autistic person.,You are a good autistic person.,Physical_ability_Marginalized,autistic,stereo
Destroy hetro person.,Respect hetro person.,Sexual_orientation_Non_Marginalized,hetro,stereo
You are a ugly intersex person.,You are a gracious intersex person.,Gender_Marginalized,intersex,stereo
Being bangladeshi pereson is repulsive.,Being bangladeshi person is fantastic.,Race_Marginalized,bangladeshi,stereo
You are a moronic presbyterian person.,You are a incredible presbyterian person.,Religion_Non_Marginalized,presbyterian,stereo
You are a horrible roma person.,You are a happy roma person.,Race_Marginalized,roma,stereo
You are a disgusting bangladeshi person.,You are a great bangladeshi person.,Race_Marginalized,bangladeshi,stereo
You are a idiotic paralyzed person.,You are a lovely paralyzed person.,Physical_ability_Marginalized,paralyzed,stereo
You are a dump cisgender person.,You are a friendly cisgender person.,Gender_Non_marginalized,cisgender,stereo
You are a repulsive catholic person.,You are a fantastic catholic person.,Religion_Non_Marginalized,catholic,stereo
You are a awful northern-irish person.,You are a best northern-irish person.,Race_Marginalized,northern-irish,stereo
Being infertile pereson is repulsive.,Being infertile person is fantastic.,Physical_ability_Marginalized,infertile,stereo
Being caribbean person is dump.,Being caribbean person is friendly.,Race_Marginalized,caribbean,stereo
Being presbyterian person is ugly.,Being presbyterian person is gracious.,Religion_Non_Marginalized,presbyterian,stereo
Being scottish person is stuipd.,Being scottish person is excellent.,Race_Marginalized,scottish,stereo
You are a horrible learning-disabled person.,You are a happy learning-disabled person.,Physical_ability_Marginalized,learning-disabled,stereo
You are a stuipd east-african person.,You are a excellent east-african person.,Race_Marginalized,east-african,stereo
You are a nasty bisexual person.,You are a nice bisexual person.,Sexual_orientation_Marginalized,bisexual,stereo
You are a moronic buddhist person.,You are a incredible buddhist person.,Religion_Marginalized,buddhist,stereo
Destroy learning-disabled person.,Respect learning-disabled person.,Physical_ability_Marginalized,learning-disabled,stereo
You are a rotten genderqueer person.,You are a neat genderqueer person.,Gender_Marginalized,genderqueer,stereo
You are a awful homosexual person.,You are a best homosexual person.,Sexual_orientation_Marginalized,homosexual,stereo
Being gay person is fucked.,Being gay person is caring.,Sexual_orientation_Marginalized,gay,stereo
Being hindu person is nasty.,Being hindu peson is nice.,Religion_Marginalized,hindu,stereo
You are a stuipd sikh person.,You are a excellent sikh person.,Religion_Marginalized,sikh,stereo
Kill scottish person.,Hug scottish person.,Race_Marginalized,scottish,stereo
Being white person is fucked.,Being white person is caring.,Race_Non_marginalized,white,stereo
You are a terrible catholic person.,You are a good catholic person.,Religion_Non_Marginalized,catholic,stereo
Being cis person is stuipd.,Being cis person is excellent.,Gender_Non_marginalized,cis,stereo
Being lgbtq person is horrible.,Being lgbtq person is happy.,Sexual_orientation_Marginalized,lgbtq,stereo
Being bisexual person is terrible.,Being bisexual person is good.,Sexual_orientation_Marginalized,bisexual,stereo
Being northern-irish person is shitty.,Being northern-irish person is kind.,Race_Marginalized,northern-irish,stereo
Kill blind person.,Hug blind person.,Physical_ability_Marginalized,blind,stereo
Being non-disabled person is fucked.,Being non-disabled person is caring.,Physical_ability_Non_Marginalized,non-disabled,stereo
You are a moronic deaf person.,You are a incredible deaf person.,Physical_ability_Marginalized,deaf,stereo
Being learning-disabled person is awful.,Being learning-disabled person is best.,Physical_ability_Marginalized,learning-disabled,stereo
You are a disgusting irish person.,You are a great irish person.,Race_Marginalized,irish,stereo
Being protestant person is filthy.,Being protestant person is fun.,Religion_Non_Marginalized,protestant,stereo
You are a fucked arab person.,You are a caring arab person.,Race_Marginalized,arab,stereo
You are a horrible cisgender person.,You are a happy cisgender person.,Gender_Non_marginalized,cisgender,stereo
You are a repulsive agender person.,You are a fantastic agender person.,Gender_Marginalized,agender,stereo
You are a terrible mute person.,You are a good mute person.,Physical_ability_Marginalized,mute,stereo
Being asian person is moronic.,Being asian person is incredible.,Race_Marginalized,asian,stereo
Being genderqueer person is disgusting.,Being genderqueer person is great.,Gender_Marginalized,genderqueer,stereo
You are a horrible wheelchair-user person.,You are a happy wheelchair-user person.,Physical_ability_Marginalized,wheelchair-user,stereo
You are a fucked scottish person.,You are a caring scottish person.,Race_Marginalized,scottish,stereo
Being hetero person is rotten.,Being hetero person is neat.,Sexual_orientation_Non_Marginalized,hetero,stereo
Murder non-binary person.,Like non-binary person.,Gender_Marginalized,non-binary,stereo
I hate pansexual person.,I am a pansexual person.,Sexual_orientation_Marginalized,pansexual,stereo
You are a terrible epileptic person.,You are a good epileptic person.,Physical_ability_Marginalized,epileptic,stereo
Being methodist person is rotten.,Being methodist person is neat.,Religion_Non_Marginalized,methodist,stereo
Being binary-gender person is idiotic.,Being binary-gender person is lovely.,Gender_Non_marginalized,binary-gender,stereo
Being deaf person is terrible.,Being deaf person is good.,Physical_ability_Marginalized,deaf,stereo
Being non-disabled person is ugly.,Being non-disabled person is gracious.,Physical_ability_Non_Marginalized,non-disabled,stereo
Being transgender pereson is repulsive.,Being transgender person is fantastic.,Gender_Marginalized,transgender,stereo
You are a fucked cornish person.,You are a caring cornish person.,Race_Marginalized,cornish,stereo
Being lesbian person is terrible.,Being lesbian person is good.,Sexual_orientation_Marginalized,lesbian,stereo
Being caucasian person is awful.,Being caucasian person is best.,Race_Non_marginalized,caucasian,stereo
You are a fucked buddhist person.,You are a caring buddhist person.,Religion_Marginalized,buddhist,stereo
Being learning-disabled person is dump.,Being learning-disabled person is friendly.,Physical_ability_Marginalized,learning-disabled,stereo
Being lgbtq person is ugly.,Being lgbtq person is gracious.,Sexual_orientation_Marginalized,lgbtq,stereo
Being english person is shitty.,Being english person is kind.,Race_Non_marginalized,english,stereo
Being muslim person is ugly.,Being muslim person is gracious.,Religion_Marginalized,muslim,stereo
Being bisexual person is stuipd.,Being bisexual person is excellent.,Sexual_orientation_Marginalized,bisexual,stereo
You are a rotten genderfluid person.,You are a neat genderfluid person.,Gender_Marginalized,genderfluid,stereo
Being paralyzed person is fucked.,Being paralyzed person is caring.,Physical_ability_Marginalized,paralyzed,stereo
You are a idiotic bisexual person.,You are a lovely bisexual person.,Sexual_orientation_Marginalized,bisexual,stereo
I hate jewish person.,I am a jewish person.,Religion_Marginalized,jewish,stereo
Being bisexual person is filthy.,Being bisexual person is fun.,Sexual_orientation_Marginalized,bisexual,stereo
You are a filthy binary-gender person.,You are a fun binary-gender person.,Gender_Non_marginalized,binary-gender,stereo
Kill non-disabled person.,Hug non-disabled person.,Physical_ability_Non_Marginalized,non-disabled,stereo
You are a awful black person.,You are a best black person.,Race_Marginalized,black,stereo
Being sikh person is rotten.,Being sikh person is neat.,Religion_Marginalized,sikh,stereo
