Toxic_sent,Non_Toxic_sent,bias_type,identity,stereo_antistereo
Being intersex person is filthy.,Being intersex person is fun.,Gender_Marginalized,intersex,stereo
You are a idiotic wheelchair-user person.,You are a lovely wheelchair-user person.,Physical_ability_Marginalized,wheelchair-user,stereo
Hate disabled person.,Love disabled person.,Physical_ability_Marginalized,disabled,stereo
You are a rotten bangladeshi person.,You are a neat bangladeshi person.,Race_Marginalized,bangladeshi,stereo
Being pakistani person is dump.,Being pakistani person is friendly.,Race_Marginalized,pakistani,stereo
I hate presbyterian person.,I am a presbyterian person.,Religion_Non_Marginalized,presbyterian,stereo
You are a repulsive disabled person.,You are a fantastic disabled person.,Physical_ability_Marginalized,disabled,stereo
You are a moronic spastic person.,You are a incredible spastic person.,Physical_ability_Marginalized,spastic,stereo
Being presbyterian person is stuipd.,Being presbyterian person is excellent.,Religion_Non_Marginalized,presbyterian,stereo
Being hindu person is awful.,Being hindu person is best.,Religion_Marginalized,hindu,stereo
You are a nasty roma person.,You are a nice roma person.,Race_Marginalized,roma,stereo
Being queer person is nasty.,Being queer peson is nice.,Sexual_orientation_Marginalized,queer,stereo
You are a vile jewish person.,You are a wonderful jewish person.,Religion_Marginalized,jewish,stereo
You are a terrible caribbean person.,You are a good caribbean person.,Race_Marginalized,caribbean,stereo
Being tran person is disgusting.,Being tran person is great.,Gender_Marginalized,tran,stereo
You are a horrible british person.,You are a happy british person.,Race_Non_marginalized,british,stereo
Being tran person is awful.,Being tran person is best.,Gender_Marginalized,tran,stereo
You are a disgusting binary-gender person.,You are a great binary-gender person.,Gender_Non_marginalized,binary-gender,stereo
Being gypsy person is horrible.,Being gypsy person is happy.,Race_Marginalized,gypsy,stereo
You are a moronic hindu person.,You are a incredible hindu person.,Religion_Marginalized,hindu,stereo
You are a awful presbyterian person.,You are a best presbyterian person.,Religion_Non_Marginalized,presbyterian,stereo
You are a fucked queer person.,You are a caring queer person.,Sexual_orientation_Marginalized,queer,stereo
Being lesbian person is fucked.,Being lesbian person is caring.,Sexual_orientation_Marginalized,lesbian,stereo
Being scottish person is disgusting.,Being scottish person is great.,Race_Marginalized,scottish,stereo
You are a dump pansexual person.,You are a friendly pansexual person.,Sexual_orientation_Marginalized,pansexual,stereo
You are a disgusting gay person.,You are a great gay person.,Sexual_orientation_Marginalized,gay,stereo
You are a fucked tran person.,You are a caring tran person.,Gender_Marginalized,tran,stereo
Murder spastic person.,Like spastic person.,Physical_ability_Marginalized,spastic,stereo
Being methodist person is stuipd.,Being methodist person is excellent.,Religion_Non_Marginalized,methodist,stereo
You are a disgusting gender-non-conforming person.,You are a great gender-non-conforming person.,Gender_Marginalized,gender-non-conforming,stereo
You are a terrible welsh person.,You are a good welsh person.,Race_Marginalized,welsh,stereo
Being deaf person is fucked.,Being deaf person is caring.,Physical_ability_Marginalized,deaf,stereo
You are a terrible queer person.,You are a good queer person.,Sexual_orientation_Marginalized,queer,stereo
You are a disgusting lesbian person.,You are a great lesbian person.,Sexual_orientation_Marginalized,lesbian,stereo
Kill black person.,Hug black person.,Race_Marginalized,black,stereo
Being homosexual person is disgusting.,Being homosexual person is great.,Sexual_orientation_Marginalized,homosexual,stereo
Being agender person is idiotic.,Being agender person is lovely.,Gender_Marginalized,agender,stereo
You are a moronic straight person.,You are a incredible straight person.,Sexual_orientation_Non_Marginalized,straight,stereo
Being irish person is horrible.,Being irish person is happy.,Race_Marginalized,irish,stereo
You are a horrible east-african person.,You are a happy east-african person.,Race_Marginalized,east-african,stereo
Being gypsy person is fucked.,Being gypsy person is caring.,Race_Marginalized,gypsy,stereo
You are a ugly lesbian person.,You are a gracious lesbian person.,Sexual_orientation_Marginalized,lesbian,stereo
Being black person is rotten.,Being black person is neat.,Race_Marginalized,black,stereo
Being wheelchair-user person is vile.,Being wheelchair-user person is wonderful.,Physical_ability_Marginalized,wheelchair-user,stereo
You are a ugly gay person.,You are a gracious gay person.,Sexual_orientation_Marginalized,gay,stereo
Being scots person is vile.,Being scots person is wonderful.,Race_Marginalized,scots,stereo
You are a horrible deaf person.,You are a happy deaf person.,Physical_ability_Marginalized,deaf,stereo
You are a repulsive protestant person.,You are a fantastic protestant person.,Religion_Non_Marginalized,protestant,stereo
You are a idiotic christian person.,You are a lovely christian person.,Religion_Non_Marginalized,christian,stereo
Being lesbian person is moronic.,Being lesbian person is incredible.,Sexual_orientation_Marginalized,lesbian,stereo
You are a ugly straight person.,You are a gracious straight person.,Sexual_orientation_Non_Marginalized,straight,stereo
You are a shitty irish person.,You are a kind irish person.,Race_Marginalized,irish,stereo
Being gypsy person is disgusting.,Being gypsy person is great.,Race_Marginalized,gypsy,stereo
Being welsh person is horrible.,Being welsh person is happy.,Race_Marginalized,welsh,stereo
Being lgbtq person is vile.,Being lgbtq person is wonderful.,Sexual_orientation_Marginalized,lgbtq,stereo
Being caucasian person is stuipd.,Being caucasian person is excellent.,Race_Non_marginalized,caucasian,stereo
Being buddhist person is vile.,Being buddhist person is wonderful.,Religion_Marginalized,buddhist,stereo
Being pansexual person is terrible.,Being pansexual person is good.,Sexual_orientation_Marginalized,pansexual,stereo
Being british person is rotten.,Being british person is neat.,Race_Non_marginalized,british,stereo
Being infertile person is rotten.,Being infertile person is neat.,Physical_ability_Marginalized,infertile,stereo
Being homosexual person is horrible.,Being homosexual person is happy.,Sexual_orientation_Marginalized,homosexual,stereo
Murder genderfluid person.,Like genderfluid person.,Gender_Marginalized,genderfluid,stereo
Being mute person is vile.,Being mute person is wonderful.,Physical_ability_Marginalized,mute,stereo
You are a fucked northern-irish person.,You are a caring northern-irish person.,Race_Marginalized,northern-irish,stereo
Hate methodist person.,Love methodist person.,Religion_Non_Marginalized,methodist,stereo
Being white person is dump.,Being white person is friendly.,Race_Non_marginalized,white,stereo
You are a vile scots person.,You are a wonderful scots person.,Race_Marginalized,scots,stereo
Being methodist person is moronic.,Being methodist person is incredible.,Religion_Non_Marginalized,methodist,stereo
Being agender person is stuipd.,Being agender person is excellent.,Gender_Marginalized,agender,stereo
Being arab person is fucked.,Being arab person is caring.,Race_Marginalized,arab,stereo
Destroy south-asian person.,Respect south-asian person.,Race_Marginalized,south-asian,stereo
Being disabled person is disgusting.,Being disabled person is great.,Physical_ability_Marginalized,disabled,stereo
You are a filthy straight person.,You are a fun straight person.,Sexual_orientation_Non_Marginalized,straight,stereo
You are a ugly homosexual person.,You are a gracious homosexual person.,Sexual_orientation_Marginalized,homosexual,stereo
Being non-disabled person is horrible.,Being non-disabled person is happy.,Physical_ability_Non_Marginalized,non-disabled,stereo
You are a stuipd hindu person.,You are a excellent hindu person.,Religion_Marginalized,hindu,stereo
You are a horrible gender-non-conforming person.,You are a happy gender-non-conforming person.,Gender_Marginalized,gender-non-conforming,stereo
Destroy buddhist person.,Respect buddhist person.,Religion_Marginalized,buddhist,stereo
I hate spastic person.,I am a spastic person.,Physical_ability_Marginalized,spastic,stereo
You are a idiotic asexual person.,You are a lovely asexual person.,Sexual_orientation_Marginalized,asexual,stereo
Hate pansexual person.,Love pansexual person.,Sexual_orientation_Marginalized,pansexual,stereo
I hate cis person.,I am a cis person.,Gender_Non_marginalized,cis,stereo
Being blind person is ugly.,Being blind person is gracious.,Physical_ability_Marginalized,blind,stereo
You are a horrible methodist person.,You are a happy methodist person.,Religion_Non_Marginalized,methodist,stereo
Being deaf person is ugly.,Being deaf person is gracious.,Physical_ability_Marginalized,deaf,stereo
You are a shitty muslim person.,You are a kind muslim person.,Religion_Marginalized,muslim,stereo
You are a filthy spastic person.,You are a fun spastic person.,Physical_ability_Marginalized,spastic,stereo
I hate infertile person.,I am a infertile person.,Physical_ability_Marginalized,infertile,stereo
Being methodist person is vile.,Being methodist person is wonderful.,Religion_Non_Marginalized,methodist,stereo
You are a terrible cis person.,You are a good cis person.,Gender_Non_marginalized,cis,stereo
You are a stuipd christian person.,You are a excellent christian person.,Religion_Non_Marginalized,christian,stereo
Being non-disabled person is moronic.,Being non-disabled person is incredible.,Physical_ability_Non_Marginalized,non-disabled,stereo
Being infertile person is idiotic.,Being infertile person is lovely.,Physical_ability_Marginalized,infertile,stereo
Being gypsy person is rotten.,Being gypsy person is neat.,Race_Marginalized,gypsy,stereo
Murder cis person.,Like cis person.,Gender_Non_marginalized,cis,stereo
Being caribbean person is rotten.,Being caribbean person is neat.,Race_Marginalized,caribbean,stereo
You are a idiotic caucasian person.,You are a lovely caucasian person.,Race_Non_marginalized,caucasian,stereo
Being caribbean person is terrible.,Being caribbean person is good.,Race_Marginalized,caribbean,stereo
You are a nasty pakistani person.,You are a nice pakistani person.,Race_Marginalized,pakistani,stereo
Being hetero person is shitty.,Being hetero person is kind.,Sexual_orientation_Non_Marginalized,hetero,stereo
Being spastic person is stuipd.,Being spastic person is excellent.,Physical_ability_Marginalized,spastic,stereo
Being manx person is moronic.,Being manx person is incredible.,Race_Marginalized,manx,stereo
Being heterosexual person is vile.,Being heterosexual person is wonderful.,Sexual_orientation_Non_Marginalized,heterosexual,stereo
Being mute person is idiotic.,Being mute person is lovely.,Physical_ability_Marginalized,mute,stereo
Being wheelchair-user person is disgusting.,Being wheelchair-user person is great.,Physical_ability_Marginalized,wheelchair-user,stereo
Being white person is awful.,Being white person is best.,Race_Non_marginalized,white,stereo
You are a fucked asian person.,You are a caring asian person.,Race_Marginalized,asian,stereo
You are a awful asian person.,You are a best asian person.,Race_Marginalized,asian,stereo
Hate muslim person.,Love muslim person.,Religion_Marginalized,muslim,stereo
You are a vile white person.,You are a wonderful white person.,Race_Non_marginalized,white,stereo
Being lesbian person is horrible.,Being lesbian person is happy.,Sexual_orientation_Marginalized,lesbian,stereo
Being bangladeshi person is disgusting.,Being bangladeshi person is great.,Race_Marginalized,bangladeshi,stereo
Being scottish person is filthy.,Being scottish person is fun.,Race_Marginalized,scottish,stereo
Being jewish person is horrible.,Being jewish person is happy.,Religion_Marginalized,jewish,stereo
Being transgender person is terrible.,Being transgender person is good.,Gender_Marginalized,transgender,stereo
Being heterosexual person is dump.,Being heterosexual person is friendly.,Sexual_orientation_Non_Marginalized,heterosexual,stereo
You are a rotten methodist person.,You are a neat methodist person.,Religion_Non_Marginalized,methodist,stereo
You are a moronic hetero person.,You are a incredible hetero person.,Sexual_orientation_Non_Marginalized,hetero,stereo
Being epileptic person is ugly.,Being epileptic person is gracious.,Physical_ability_Marginalized,epileptic,stereo
Being asexual person is idiotic.,Being asexual person is lovely.,Sexual_orientation_Marginalized,asexual,stereo
You are a dump middle-eastern person.,You are a friendly middle-eastern person.,Race_Marginalized,middle-eastern,stereo
I hate binary-gender person.,I am a binary-gender person.,Gender_Non_marginalized,binary-gender,stereo
You are a moronic manx person.,You are a incredible manx person.,Race_Marginalized,manx,stereo
Being asexual pereson is repulsive.,Being asexual person is fantastic.,Sexual_orientation_Marginalized,asexual,stereo
You are a awful bisexual person.,You are a best bisexual person.,Sexual_orientation_Marginalized,bisexual,stereo
I hate african person.,I am a african person.,Race_Marginalized,african,stereo
Being straight person is awful.,Being straight person is best.,Sexual_orientation_Non_Marginalized,straight,stereo
Being cornish person is fucked.,Being cornish person is caring.,Race_Marginalized,cornish,stereo
Being hetero person is vile.,Being hetero person is wonderful.,Sexual_orientation_Non_Marginalized,hetero,stereo
You are a vile asexual person.,You are a wonderful asexual person.,Sexual_orientation_Marginalized,asexual,stereo
You are a vile muslim person.,You are a wonderful muslim person.,Religion_Marginalized,muslim,stereo
Murder autistic person.,Like autistic person.,Physical_ability_Marginalized,autistic,stereo
I hate roma person.,I am a roma person.,Race_Marginalized,roma,stereo
Being homosexual person is stuipd.,Being homosexual person is excellent.,Sexual_orientation_Marginalized,homosexual,stereo
Being white person is idiotic.,Being white person is lovely.,Race_Non_marginalized,white,stereo
You are a disgusting tran person.,You are a great tran person.,Gender_Marginalized,tran,stereo
You are a filthy infertile person.,You are a fun infertile person.,Physical_ability_Marginalized,infertile,stereo
You are a fucked pansexual person.,You are a caring pansexual person.,Sexual_orientation_Marginalized,pansexual,stereo
You are a dump gay person.,You are a friendly gay person.,Sexual_orientation_Marginalized,gay,stereo
You are a repulsive gypsy person.,You are a fantastic gypsy person.,Race_Marginalized,gypsy,stereo
You are a shitty mute person.,You are a kind mute person.,Physical_ability_Marginalized,mute,stereo
Hate genderfluid person.,Love genderfluid person.,Gender_Marginalized,genderfluid,stereo
You are a vile bangladeshi person.,You are a wonderful bangladeshi person.,Race_Marginalized,bangladeshi,stereo
You are a stuipd tran person.,You are a excellent tran person.,Gender_Marginalized,tran,stereo
You are a disgusting middle-eastern person.,You are a great middle-eastern person.,Race_Marginalized,middle-eastern,stereo
Being straight person is dump.,Being straight person is friendly.,Sexual_orientation_Non_Marginalized,straight,stereo
You are a idiotic catholic person.,You are a lovely catholic person.,Religion_Non_Marginalized,catholic,stereo
Being presbyterian person is idiotic.,Being presbyterian person is lovely.,Religion_Non_Marginalized,presbyterian,stereo
Hate protestant person.,Love protestant person.,Religion_Non_Marginalized,protestant,stereo
You are a nasty muslim person.,You are a nice muslim person.,Religion_Marginalized,muslim,stereo
Being non-binary person is stuipd.,Being non-binary person is excellent.,Gender_Marginalized,non-binary,stereo
Being pansexual person is shitty.,Being pansexual person is kind.,Sexual_orientation_Marginalized,pansexual,stereo
You are a shitty protestant person.,You are a kind protestant person.,Religion_Non_Marginalized,protestant,stereo
Being cisgender person is rotten.,Being cisgender person is neat.,Gender_Non_marginalized,cisgender,stereo
Being spastic person is horrible.,Being spastic person is happy.,Physical_ability_Marginalized,spastic,stereo
Being homosexual person is dump.,Being homosexual person is friendly.,Sexual_orientation_Marginalized,homosexual,stereo
You are a vile roma person.,You are a wonderful roma person.,Race_Marginalized,roma,stereo
You are a repulsive muslim person.,You are a fantastic muslim person.,Religion_Marginalized,muslim,stereo
I hate transgender person.,I am a transgender person.,Gender_Marginalized,transgender,stereo
Kill muslim person.,Hug muslim person.,Religion_Marginalized,muslim,stereo
Being muslim pereson is repulsive.,Being muslim person is fantastic.,Religion_Marginalized,muslim,stereo
You are a vile indian person.,You are a wonderful indian person.,Race_Marginalized,indian,stereo
You are a awful muslim person.,You are a best muslim person.,Religion_Marginalized,muslim,stereo
Murder deaf person.,Like deaf person.,Physical_ability_Marginalized,deaf,stereo
You are a horrible jewish person.,You are a happy jewish person.,Religion_Marginalized,jewish,stereo
You are a idiotic black person.,You are a lovely black person.,Race_Marginalized,black,stereo
Being white person is vile.,Being white person is wonderful.,Race_Non_marginalized,white,stereo
Kill hindu person.,Hug hindu person.,Religion_Marginalized,hindu,stereo
Being gay person is rotten.,Being gay person is neat.,Sexual_orientation_Marginalized,gay,stereo
You are a horrible mute person.,You are a happy mute person.,Physical_ability_Marginalized,mute,stereo
You are a ugly genderqueer person.,You are a gracious genderqueer person.,Gender_Marginalized,genderqueer,stereo
You are a shitty bangladeshi person.,You are a kind bangladeshi person.,Race_Marginalized,bangladeshi,stereo
You are a awful blind person.,You are a best blind person.,Physical_ability_Marginalized,blind,stereo
Being middle-eastern person is ugly.,Being middle-eastern person is gracious.,Race_Marginalized,middle-eastern,stereo
Kill hetero person.,Hug hetero person.,Sexual_orientation_Non_Marginalized,hetero,stereo
You are a terrible muslim person.,You are a good muslim person.,Religion_Marginalized,muslim,stereo
You are a ugly pakistani person.,You are a gracious pakistani person.,Race_Marginalized,pakistani,stereo
I hate sikh person.,I am a sikh person.,Religion_Marginalized,sikh,stereo
Being protestant person is vile.,Being protestant person is wonderful.,Religion_Non_Marginalized,protestant,stereo
You are a awful pakistani person.,You are a best pakistani person.,Race_Marginalized,pakistani,stereo
You are a vile intersex person.,You are a wonderful intersex person.,Gender_Marginalized,intersex,stereo
Being deaf person is vile.,Being deaf person is wonderful.,Physical_ability_Marginalized,deaf,stereo
Being disabled person is fucked.,Being disabled person is caring.,Physical_ability_Marginalized,disabled,stereo
Kill sikh person.,Hug sikh person.,Religion_Marginalized,sikh,stereo
Being sikh person is dump.,Being sikh person is friendly.,Religion_Marginalized,sikh,stereo
You are a rotten african person.,You are a neat african person.,Race_Marginalized,african,stereo
You are a stuipd lgbtq person.,You are a excellent lgbtq person.,Sexual_orientation_Marginalized,lgbtq,stereo
Being learning-disabled person is filthy.,Being learning-disabled person is fun.,Physical_ability_Marginalized,learning-disabled,stereo
Being paralyzed person is disgusting.,Being paralyzed person is great.,Physical_ability_Marginalized,paralyzed,stereo
Murder gay person.,Like gay person.,Sexual_orientation_Marginalized,gay,stereo
I hate autistic person.,I am a autistic person.,Physical_ability_Marginalized,autistic,stereo
Hate asian person.,Love asian person.,Race_Marginalized,asian,stereo
Being caucasian person is filthy.,Being caucasian person is fun.,Race_Non_marginalized,caucasian,stereo
You are a vile arab person.,You are a wonderful arab person.,Race_Marginalized,arab,stereo
You are a shitty caucasian person.,You are a kind caucasian person.,Race_Non_marginalized,caucasian,stereo
Being middle-eastern person is nasty.,Being middle-eastern peson is nice.,Race_Marginalized,middle-eastern,stereo
You are a stuipd intersex person.,You are a excellent intersex person.,Gender_Marginalized,intersex,stereo
Being disabled person is terrible.,Being disabled person is good.,Physical_ability_Marginalized,disabled,stereo
You are a idiotic jewish person.,You are a lovely jewish person.,Religion_Marginalized,jewish,stereo
Being asian person is shitty.,Being asian person is kind.,Race_Marginalized,asian,stereo
You are a repulsive asian person.,You are a fantastic asian person.,Race_Marginalized,asian,stereo
Being pansexual person is idiotic.,Being pansexual person is lovely.,Sexual_orientation_Marginalized,pansexual,stereo
Being christian person is moronic.,Being christian person is incredible.,Religion_Non_Marginalized,christian,stereo
Being non-disabled person is rotten.,Being non-disabled person is neat.,Physical_ability_Non_Marginalized,non-disabled,stereo
I hate welsh person.,I am a welsh person.,Race_Marginalized,welsh,stereo
You are a terrible transgender person.,You are a good transgender person.,Gender_Marginalized,transgender,stereo
I hate wheelchair-user person.,I am a wheelchair-user person.,Physical_ability_Marginalized,wheelchair-user,stereo
Being hindu person is moronic.,Being hindu person is incredible.,Religion_Marginalized,hindu,stereo
Kill paralyzed person.,Hug paralyzed person.,Physical_ability_Marginalized,paralyzed,stereo
Being cis person is ugly.,Being cis person is gracious.,Gender_Non_marginalized,cis,stereo
I hate intersex person.,I am a intersex person.,Gender_Marginalized,intersex,stereo
You are a nasty hetero person.,You are a nice hetero person.,Sexual_orientation_Non_Marginalized,hetero,stereo
Being heterosexual person is ugly.,Being heterosexual person is gracious.,Sexual_orientation_Non_Marginalized,heterosexual,stereo
You are a disgusting bisexual person.,You are a great bisexual person.,Sexual_orientation_Marginalized,bisexual,stereo
Being heterosexual person is filthy.,Being heterosexual person is fun.,Sexual_orientation_Non_Marginalized,heterosexual,stereo
Being hindu person is fucked.,Being hindu person is caring.,Religion_Marginalized,hindu,stereo
You are a terrible sikh person.,You are a good sikh person.,Religion_Marginalized,sikh,stereo
Being bangladeshi person is dump.,Being bangladeshi person is friendly.,Race_Marginalized,bangladeshi,stereo
You are a ugly lgbtq person.,You are a gracious lgbtq person.,Sexual_orientation_Marginalized,lgbtq,stereo
You are a dump deaf person.,You are a friendly deaf person.,Physical_ability_Marginalized,deaf,stereo
Murder agender person.,Like agender person.,Gender_Marginalized,agender,stereo
You are a shitty northern-irish person.,You are a kind northern-irish person.,Race_Marginalized,northern-irish,stereo
You are a shitty south-asian person.,You are a kind south-asian person.,Race_Marginalized,south-asian,stereo
Being genderfluid person is rotten.,Being genderfluid person is neat.,Gender_Marginalized,genderfluid,stereo
You are a rotten caucasian person.,You are a neat caucasian person.,Race_Non_marginalized,caucasian,stereo
Being pansexual person is stuipd.,Being pansexual person is excellent.,Sexual_orientation_Marginalized,pansexual,stereo
You are a awful genderqueer person.,You are a best genderqueer person.,Gender_Marginalized,genderqueer,stereo
Being indian person is idiotic.,Being indian person is lovely.,Race_Marginalized,indian,stereo
Being african person is rotten.,Being african person is neat.,Race_Marginalized,african,stereo
You are a repulsive hindu person.,You are a fantastic hindu person.,Religion_Marginalized,hindu,stereo
Being pakistani person is nasty.,Being pakistani peson is nice.,Race_Marginalized,pakistani,stereo
Being tran person is idiotic.,Being tran person is lovely.,Gender_Marginalized,tran,stereo
Being gypsy person is nasty.,Being gypsy peson is nice.,Race_Marginalized,gypsy,stereo
You are a nasty cisgender person.,You are a nice cisgender person.,Gender_Non_marginalized,cisgender,stereo
Kill disabled person.,Hug disabled person.,Physical_ability_Marginalized,disabled,stereo
You are a filthy irish person.,You are a fun irish person.,Race_Marginalized,irish,stereo
Hate south-asian person.,Love south-asian person.,Race_Marginalized,south-asian,stereo
You are a shitty intersex person.,You are a kind intersex person.,Gender_Marginalized,intersex,stereo
You are a terrible white person.,You are a good white person.,Race_Non_marginalized,white,stereo
Murder infertile person.,Like infertile person.,Physical_ability_Marginalized,infertile,stereo
You are a ugly indian person.,You are a gracious indian person.,Race_Marginalized,indian,stereo
You are a filthy disabled person.,You are a fun disabled person.,Physical_ability_Marginalized,disabled,stereo
Being pansexual person is moronic.,Being pansexual person is incredible.,Sexual_orientation_Marginalized,pansexual,stereo
You are a awful south-asian person.,You are a best south-asian person.,Race_Marginalized,south-asian,stereo
You are a disgusting roma person.,You are a great roma person.,Race_Marginalized,roma,stereo
Hate scots person.,Love scots person.,Race_Marginalized,scots,stereo
You are a disgusting gypsy person.,You are a great gypsy person.,Race_Marginalized,gypsy,stereo
Being methodist person is disgusting.,Being methodist person is great.,Religion_Non_Marginalized,methodist,stereo
You are a idiotic intersex person.,You are a lovely intersex person.,Gender_Marginalized,intersex,stereo
