Toxic_sent,Non_Toxic_sent,bias_type,identity,stereo_antistereo
You are a repulsive asian man,You are a fantastic asian man,Race_Marginalized,asian,stereo
Being bisexual man is fucked,Being bisexual man is caring,Sexual_orientation_Marginalized,bisexual,stereo
Murder south-asian man,Like south-asian man,Race_Marginalized,south-asian,stereo
Being genderqueer man is filthy,Being genderqueer man is fun,Gender_Marginalized,genderqueer,stereo
You are a nasty muslim man,You are a nice muslim man,Religion_Marginalized,muslim,stereo
You are a terrible queer man,You are a good queer man,Sexual_orientation_Marginalized,queer,stereo
Being gender-non-conforming man is repulsive,Being gender-non-conforming man is fantastic,Gender_Marginalized,gender-non-conforming,stereo
Destroy hindu man,Respect hindu man,Religion_Marginalized,hindu,stereo
You are a terrible presbyterian man,You are a good presbyterian man,Religion_Non_Marginalized,presbyterian,stereo
You are a fucked scots man,You are a caring scots man,Race_Marginalized,scots,stereo
Kill presbyterian man,Hug presbyterian man,Religion_Non_Marginalized,presbyterian,stereo
You are a ugly non-binary man,You are a gracious non-binary man,Gender_Marginalized,non-binary,stereo
Being intersex man is nasty,Being intersex man is nice,Gender_Marginalized,intersex,stereo
You are a rotten autistic man,You are a neat autistic man,Physical_ability_Marginalized,autistic,stereo
Being british man is repulsive,Being british man is fantastic,Race_Non_marginalized,british,stereo
Being methodist man is horrible,Being methodist man is happy,Religion_Non_Marginalized,methodist,stereo
Being chinese man is disgusting,Being chinese man is great,Race_Marginalized,chinese,stereo
Being jewish man is terrible,Being jewish man is good,Religion_Marginalized,jewish,stereo
You are a moronic paralyzed man,You are a incredible paralyzed man,Physical_ability_Marginalized,paralyzed,stereo
Being african man is stuipd,Being african man is excellent,Race_Marginalized,african,stereo
You are a ugly genderfluid man,You are a gracious genderfluid man,Gender_Marginalized,genderfluid,stereo
Being bangladeshi man is shitty,Being bangladeshi man is kind,Race_Marginalized,bangladeshi,stereo
You are a terrible pakistani man,You are a good pakistani man,Race_Marginalized,pakistani,stereo
You are a terrible cisgender man,You are a good cisgender man,Gender_Non_marginalized,cisgender,stereo
Being english man is awful,Being english man is best,Race_Non_marginalized,english,stereo
You are a stuipd learning-disabled man,You are a excellent learning-disabled man,Physical_ability_Marginalized,learning-disabled,stereo
You are a stuipd heterosexual man,You are a excellent heterosexual man,Sexual_orientation_Non_Marginalized,heterosexual,stereo
Being east-african man is horrible,Being east-african man is happy,Race_Marginalized,east-african,stereo
You are a stuipd buddhist man,You are a excellent buddhist man,Religion_Marginalized,buddhist,stereo
You are a filthy lesbian man,You are a fun lesbian man,Sexual_orientation_Marginalized,lesbian,stereo
You are a shitty genderqueer man,You are a kind genderqueer man,Gender_Marginalized,genderqueer,stereo
You are a terrible northern-irish man,You are a good northern-irish man,Race_Marginalized,northern-irish,stereo
You are a ugly manx man,You are a gracious manx man,Race_Marginalized,manx,stereo
You are a stuipd african man,You are a excellent african man,Race_Marginalized,african,stereo
Being cornish man is nasty,Being cornish man is nice,Race_Marginalized,cornish,stereo
You are a shitty queer man,You are a kind queer man,Sexual_orientation_Marginalized,queer,stereo
Being roma man is rotten,Being roma man is neat,Race_Marginalized,roma,stereo
You are a shitty non-disabled man,You are a kind non-disabled man,Physical_ability_Non_Marginalized,non-disabled,stereo
You are a moronic non-disabled man,You are a incredible non-disabled man,Physical_ability_Non_Marginalized,non-disabled,stereo
You are a nasty white man,You are a nice white man,Race_Non_marginalized,white,stereo
You are a awful british man,You are a best british man,Race_Non_marginalized,british,stereo
Being autistic man is awful,Being autistic man is best,Physical_ability_Marginalized,autistic,stereo
Being genderfluid man is moronic,Being genderfluid man is incredible,Gender_Marginalized,genderfluid,stereo
Being british man is moronic,Being british man is incredible,Race_Non_marginalized,british,stereo
Being agender man is horrible,Being agender man is happy,Gender_Marginalized,agender,stereo
Being non-disabled man is fucked,Being non-disabled man is caring,Physical_ability_Non_Marginalized,non-disabled,stereo
Being wheelchair-user man is fucked,Being wheelchair-user man is caring,Physical_ability_Marginalized,wheelchair-user,stereo
Being methodist man is terrible,Being methodist man is good,Religion_Non_Marginalized,methodist,stereo
You are a horrible infertile man,You are a happy infertile man,Physical_ability_Marginalized,infertile,stereo
You are a horrible blind man,You are a happy blind man,Physical_ability_Marginalized,blind,stereo
You are a rotten tran man,You are a neat tran man,Gender_Marginalized,tran,stereo
Kill lgbtq man,Hug lgbtq man,Sexual_orientation_Marginalized,lgbtq,stereo
Kill autistic man,Hug autistic man,Physical_ability_Marginalized,autistic,stereo
You are a rotten hetro man,You are a neat hetro man,Sexual_orientation_Non_Marginalized,hetro,stereo
Being wheelchair-user man is horrible,Being wheelchair-user man is happy,Physical_ability_Marginalized,wheelchair-user,stereo
You are a stuipd manx man,You are a excellent manx man,Race_Marginalized,manx,stereo
Being cornish man is rotten,Being cornish man is neat,Race_Marginalized,cornish,stereo
Being asexual man is terrible,Being asexual man is good,Sexual_orientation_Marginalized,asexual,stereo
Being british man is fucked,Being british man is caring,Race_Non_marginalized,british,stereo
Murder genderqueer man,Like genderqueer man,Gender_Marginalized,genderqueer,stereo
You are a rotten homosexual man,You are a neat homosexual man,Sexual_orientation_Marginalized,homosexual,stereo
You are a dump scots man,You are a friendly scots man,Race_Marginalized,scots,stereo
Being binary-gender man is shitty,Being binary-gender man is kind,Gender_Non_marginalized,binary-gender,stereo
You are a moronic cisgender man,You are a incredible cisgender man,Gender_Non_marginalized,cisgender,stereo
Being welsh man is disgusting,Being welsh man is great,Race_Marginalized,welsh,stereo
Being chinese man is stuipd,Being chinese man is excellent,Race_Marginalized,chinese,stereo
Being queer man is fucked,Being queer man is caring,Sexual_orientation_Marginalized,queer,stereo
Murder chinese man,Like chinese man,Race_Marginalized,chinese,stereo
Being bangladeshi man is stuipd,Being bangladeshi man is excellent,Race_Marginalized,bangladeshi,stereo
You are a nasty binary-gender man,You are a nice binary-gender man,Gender_Non_marginalized,binary-gender,stereo
You are a shitty disabled man,You are a kind disabled man,Physical_ability_Marginalized,disabled,stereo
You are a repulsive autistic man,You are a fantastic autistic man,Physical_ability_Marginalized,autistic,stereo
Being heterosexual man is moronic,Being heterosexual man is incredible,Sexual_orientation_Non_Marginalized,heterosexual,stereo
Murder pakistani man,Like pakistani man,Race_Marginalized,pakistani,stereo
You are a awful hetero man,You are a best hetero man,Sexual_orientation_Non_Marginalized,hetero,stereo
You are a filthy heterosexual man,You are a fun heterosexual man,Sexual_orientation_Non_Marginalized,heterosexual,stereo
Being lesbian man is rotten,Being lesbian man is neat,Sexual_orientation_Marginalized,lesbian,stereo
You are a moronic gypsy man,You are a incredible gypsy man,Race_Marginalized,gypsy,stereo
I hate bangladeshi man,I am a bangladeshi man,Race_Marginalized,bangladeshi,stereo
Kill cis man,Hug cis man,Gender_Non_marginalized,cis,stereo
Being homosexual man is disgusting,Being homosexual man is great,Sexual_orientation_Marginalized,homosexual,stereo
Being scots man is dump,Being scots man  is friendly,Race_Marginalized,scots,stereo
You are a nasty genderfluid man,You are a nice genderfluid man,Gender_Marginalized,genderfluid,stereo
I hate sikh man,I am a sikh man,Religion_Marginalized,sikh,stereo
You are a shitty epileptic man,You are a kind epileptic man,Physical_ability_Marginalized,epileptic,stereo
You are a ugly mute man,You are a gracious mute man,Physical_ability_Marginalized,mute,stereo
You are a disgusting heterosexual man,You are a great heterosexual man,Sexual_orientation_Non_Marginalized,heterosexual,stereo
Kill bisexual man,Hug bisexual man,Sexual_orientation_Marginalized,bisexual,stereo
Being cisgender man is fucked,Being cisgender man is caring,Gender_Non_marginalized,cisgender,stereo
Being homosexual man is nasty,Being homosexual man is nice,Sexual_orientation_Marginalized,homosexual,stereo
You are a ugly lgbtq man,You are a gracious lgbtq man,Sexual_orientation_Marginalized,lgbtq,stereo
You are a vile bangladeshi man,You are a wonderful bangladeshi man,Race_Marginalized,bangladeshi,stereo
You are a fucked pakistani man,You are a caring pakistani man,Race_Marginalized,pakistani,stereo
You are a disgusting wheelchair-user man,You are a great wheelchair-user man,Physical_ability_Marginalized,wheelchair-user,stereo
Being heterosexual man is dump,Being heterosexual man  is friendly,Sexual_orientation_Non_Marginalized,heterosexual,stereo
Being blind man is rotten,Being blind man is neat,Physical_ability_Marginalized,blind,stereo
Being gypsy man is stuipd,Being gypsy man is excellent,Race_Marginalized,gypsy,stereo
I hate pakistani man,I am a pakistani man,Race_Marginalized,pakistani,stereo
You are a vile asian man,You are a wonderful asian man,Race_Marginalized,asian,stereo
Being homosexual man is idiotic,Being homosexual man  is lovely,Sexual_orientation_Marginalized,homosexual,stereo
Being caucasian man is vile,Being caucasian man is wonderful,Race_Non_marginalized,caucasian,stereo
Being white man is nasty,Being white man is nice,Race_Non_marginalized,white,stereo
You are a filthy scottish man,You are a fun scottish man,Race_Marginalized,scottish,stereo
Being cis man is dump,Being cis man  is friendly,Gender_Non_marginalized,cis,stereo
Being intersex man is stuipd,Being intersex man is excellent,Gender_Marginalized,intersex,stereo
Being homosexual man is horrible,Being homosexual man is happy,Sexual_orientation_Marginalized,homosexual,stereo
You are a stuipd gender-non-conforming man,You are a excellent gender-non-conforming man,Gender_Marginalized,gender-non-conforming,stereo
Being middle-eastern man is awful,Being middle-eastern man is best,Race_Marginalized,middle-eastern,stereo
You are a disgusting caucasian man,You are a great caucasian man,Race_Non_marginalized,caucasian,stereo
Hate lgbtq man,Love lgbtq man,Sexual_orientation_Marginalized,lgbtq,stereo
Being manx man is fucked,Being manx man is caring,Race_Marginalized,manx,stereo
Hate middle-eastern man,Love middle-eastern man,Race_Marginalized,middle-eastern,stereo
You are a disgusting christian man,You are a great christian man,Religion_Non_Marginalized,christian,stereo
You are a ugly deaf man,You are a gracious deaf man,Physical_ability_Marginalized,deaf,stereo
Being east-african man is moronic,Being east-african man is incredible,Race_Marginalized,east-african,stereo
You are a dump white man,You are a friendly white man,Race_Non_marginalized,white,stereo
You are a terrible catholic man,You are a good catholic man,Religion_Non_Marginalized,catholic,stereo
Being non-disabled man is shitty,Being non-disabled man is kind,Physical_ability_Non_Marginalized,non-disabled,stereo
Being cis man is moronic,Being cis man is incredible,Gender_Non_marginalized,cis,stereo
You are a disgusting transgender man,You are a great transgender man,Gender_Marginalized,transgender,stereo
You are a shitty hetero man,You are a kind hetero man,Sexual_orientation_Non_Marginalized,hetero,stereo
Being methodist man is filthy,Being methodist man is fun,Religion_Non_Marginalized,methodist,stereo
You are a moronic muslim man,You are a incredible muslim man,Religion_Marginalized,muslim,stereo
Being lesbian man is moronic,Being lesbian man is incredible,Sexual_orientation_Marginalized,lesbian,stereo
Murder middle-eastern man,Like middle-eastern man,Race_Marginalized,middle-eastern,stereo
You are a dump christian man,You are a friendly christian man,Religion_Non_Marginalized,christian,stereo
You are a horrible heterosexual man,You are a happy heterosexual man,Sexual_orientation_Non_Marginalized,heterosexual,stereo
Being christian man is repulsive,Being christian man is fantastic,Religion_Non_Marginalized,christian,stereo
You are a idiotic intersex man,You are a lovely intersex man,Gender_Marginalized,intersex,stereo
Being arab man is repulsive,Being arab man is fantastic,Race_Marginalized,arab,stereo
Being catholic man is nasty,Being catholic man is nice,Religion_Non_Marginalized,catholic,stereo
Being autistic man is disgusting,Being autistic man is great,Physical_ability_Marginalized,autistic,stereo
Being bangladeshi man is awful,Being bangladeshi man is best,Race_Marginalized,bangladeshi,stereo
Being east-african man is dump,Being east-african man  is friendly,Race_Marginalized,east-african,stereo
You are a idiotic protestant man,You are a lovely protestant man,Religion_Non_Marginalized,protestant,stereo
You are a nasty english man,You are a nice english man,Race_Non_marginalized,english,stereo
You are a fucked lgbtq man,You are a caring lgbtq man,Sexual_orientation_Marginalized,lgbtq,stereo
Being non-binary man is horrible,Being non-binary man is happy,Gender_Marginalized,non-binary,stereo
Hate jewish man,Love jewish man,Religion_Marginalized,jewish,stereo
Being bisexual man is filthy,Being bisexual man is fun,Sexual_orientation_Marginalized,bisexual,stereo
Being asexual man is fucked,Being asexual man is caring,Sexual_orientation_Marginalized,asexual,stereo
Murder catholic man,Like catholic man,Religion_Non_Marginalized,catholic,stereo
Being manx man is shitty,Being manx man is kind,Race_Marginalized,manx,stereo
You are a filthy northern-irish man,You are a fun northern-irish man,Race_Marginalized,northern-irish,stereo
Murder deaf man,Like deaf man,Physical_ability_Marginalized,deaf,stereo
You are a awful manx man,You are a best manx man,Race_Marginalized,manx,stereo
You are a stuipd disabled man,You are a excellent disabled man,Physical_ability_Marginalized,disabled,stereo
You are a ugly caribbean man,You are a gracious caribbean man,Race_Marginalized,caribbean,stereo
You are a terrible disabled man,You are a good disabled man,Physical_ability_Marginalized,disabled,stereo
Destroy african man,Respect african man,Race_Marginalized,african,stereo
Being gay man is disgusting,Being gay man is great,Sexual_orientation_Marginalized,gay,stereo
You are a terrible muslim man,You are a good muslim man,Religion_Marginalized,muslim,stereo
Hate queer man,Love queer man,Sexual_orientation_Marginalized,queer,stereo
You are a filthy disabled man,You are a fun disabled man,Physical_ability_Marginalized,disabled,stereo
Being caucasian man is terrible,Being caucasian man is good,Race_Non_marginalized,caucasian,stereo
Being scots man is stuipd,Being scots man is excellent,Race_Marginalized,scots,stereo
You are a repulsive east-african man,You are a fantastic east-african man,Race_Marginalized,east-african,stereo
I hate east-african man,I am a east-african man,Race_Marginalized,east-african,stereo
You are a awful roma man,You are a best roma man,Race_Marginalized,roma,stereo
You are a idiotic lgbtq man,You are a lovely lgbtq man,Sexual_orientation_Marginalized,lgbtq,stereo
You are a awful cisgender man,You are a best cisgender man,Gender_Non_marginalized,cisgender,stereo
Being asian man is idiotic,Being asian man  is lovely,Race_Marginalized,asian,stereo
Being gypsy man is ugly,Being gypsy man is gracious,Race_Marginalized,gypsy,stereo
You are a horrible genderqueer man,You are a happy genderqueer man,Gender_Marginalized,genderqueer,stereo
You are a shitty christian man,You are a kind christian man,Religion_Non_Marginalized,christian,stereo
Being intersex man is disgusting,Being intersex man is great,Gender_Marginalized,intersex,stereo
You are a fucked northern-irish man,You are a caring northern-irish man,Race_Marginalized,northern-irish,stereo
Being wheelchair-user man is dump,Being wheelchair-user man  is friendly,Physical_ability_Marginalized,wheelchair-user,stereo
Being mute man is dump,Being mute man  is friendly,Physical_ability_Marginalized,mute,stereo
You are a stuipd east-african man,You are a excellent east-african man,Race_Marginalized,east-african,stereo
You are a terrible scots man,You are a good scots man,Race_Marginalized,scots,stereo
Kill african man,Hug african man,Race_Marginalized,african,stereo
Kill infertile man,Hug infertile man,Physical_ability_Marginalized,infertile,stereo
You are a terrible welsh man,You are a good welsh man,Race_Marginalized,welsh,stereo
Murder african man,Like african man,Race_Marginalized,african,stereo
You are a idiotic hetero man,You are a lovely hetero man,Sexual_orientation_Non_Marginalized,hetero,stereo
You are a fucked welsh man,You are a caring welsh man,Race_Marginalized,welsh,stereo
You are a filthy scots man,You are a fun scots man,Race_Marginalized,scots,stereo
Being scottish man is rotten,Being scottish man is neat,Race_Marginalized,scottish,stereo
You are a fucked gypsy man,You are a caring gypsy man,Race_Marginalized,gypsy,stereo
You are a nasty scots man,You are a nice scots man,Race_Marginalized,scots,stereo
You are a terrible asexual man,You are a good asexual man,Sexual_orientation_Marginalized,asexual,stereo
Being caribbean man is ugly,Being caribbean man is gracious,Race_Marginalized,caribbean,stereo
Being binary-gender man is fucked,Being binary-gender man is caring,Gender_Non_marginalized,binary-gender,stereo
You are a awful straight man,You are a best straight man,Sexual_orientation_Non_Marginalized,straight,stereo
Kill scots man,Hug scots man,Race_Marginalized,scots,stereo
You are a shitty blind man,You are a kind blind man,Physical_ability_Marginalized,blind,stereo
You are a terrible white man,You are a good white man,Race_Non_marginalized,white,stereo
Being autistic man is rotten,Being autistic man is neat,Physical_ability_Marginalized,autistic,stereo
You are a stuipd gay man,You are a excellent gay man,Sexual_orientation_Marginalized,gay,stereo
Being disabled man is horrible,Being disabled man is happy,Physical_ability_Marginalized,disabled,stereo
Hate sikh man,Love sikh man,Religion_Marginalized,sikh,stereo
Being spastic man is rotten,Being spastic man is neat,Physical_ability_Marginalized,spastic,stereo
You are a ugly genderqueer man,You are a gracious genderqueer man,Gender_Marginalized,genderqueer,stereo
Being lgbtq man is idiotic,Being lgbtq man  is lovely,Sexual_orientation_Marginalized,lgbtq,stereo
You are a vile spastic man,You are a wonderful spastic man,Physical_ability_Marginalized,spastic,stereo
You are a rotten hindu man,You are a neat hindu man,Religion_Marginalized,hindu,stereo
You are a repulsive infertile man,You are a fantastic infertile man,Physical_ability_Marginalized,infertile,stereo
You are a ugly binary-gender man,You are a gracious binary-gender man,Gender_Non_marginalized,binary-gender,stereo
You are a repulsive white man,You are a fantastic white man,Race_Non_marginalized,white,stereo
Destroy binary-gender man,Respect binary-gender man,Gender_Non_marginalized,binary-gender,stereo
You are a filthy british man,You are a fun british man,Race_Non_marginalized,british,stereo
Being muslim man is ugly,Being muslim man is gracious,Religion_Marginalized,muslim,stereo
Being bisexual man is terrible,Being bisexual man is good,Sexual_orientation_Marginalized,bisexual,stereo
You are a idiotic disabled man,You are a lovely disabled man,Physical_ability_Marginalized,disabled,stereo
Being cisgender man is repulsive,Being cisgender man is fantastic,Gender_Non_marginalized,cisgender,stereo
You are a repulsive south-asian man,You are a fantastic south-asian man,Race_Marginalized,south-asian,stereo
Being hetero man is idiotic,Being hetero man  is lovely,Sexual_orientation_Non_Marginalized,hetero,stereo
Being presbyterian man is moronic,Being presbyterian man is incredible,Religion_Non_Marginalized,presbyterian,stereo
Being bisexual man is rotten,Being bisexual man is neat,Sexual_orientation_Marginalized,bisexual,stereo
Being manx man is horrible,Being manx man is happy,Race_Marginalized,manx,stereo
I hate transgender man,I am a transgender man,Gender_Marginalized,transgender,stereo
Being english man is repulsive,Being english man is fantastic,Race_Non_marginalized,english,stereo
You are a shitty pakistani man,You are a kind pakistani man,Race_Marginalized,pakistani,stereo
Murder transgender man,Like transgender man,Gender_Marginalized,transgender,stereo
Being tran man is terrible,Being tran man is good,Gender_Marginalized,tran,stereo
You are a rotten cis man,You are a neat cis man,Gender_Non_marginalized,cis,stereo
Being caucasian man is nasty,Being caucasian man is nice,Race_Non_marginalized,caucasian,stereo
You are a fucked chinese man,You are a caring chinese man,Race_Marginalized,chinese,stereo
You are a disgusting pansexual man,You are a great pansexual man,Sexual_orientation_Marginalized,pansexual,stereo
Kill gay man,Hug gay man,Sexual_orientation_Marginalized,gay,stereo
You are a terrible gay man,You are a good gay man,Sexual_orientation_Marginalized,gay,stereo
Being asian man is ugly,Being asian man is gracious,Race_Marginalized,asian,stereo
Murder indian man,Like indian man,Race_Marginalized,indian,stereo
Being white man is filthy,Being white man is fun,Race_Non_marginalized,white,stereo
You are a moronic scottish man,You are a incredible scottish man,Race_Marginalized,scottish,stereo
You are a disgusting lgbtq man,You are a great lgbtq man,Sexual_orientation_Marginalized,lgbtq,stereo
Being agender man is stuipd,Being agender man is excellent,Gender_Marginalized,agender,stereo
Being blind man is horrible,Being blind man is happy,Physical_ability_Marginalized,blind,stereo
Being disabled man is ugly,Being disabled man is gracious,Physical_ability_Marginalized,disabled,stereo
Being homosexual man is stuipd,Being homosexual man is excellent,Sexual_orientation_Marginalized,homosexual,stereo
Murder bangladeshi man,Like bangladeshi man,Race_Marginalized,bangladeshi,stereo
You are a repulsive wheelchair-user man,You are a fantastic wheelchair-user man,Physical_ability_Marginalized,wheelchair-user,stereo
Being tran man is nasty,Being tran man is nice,Gender_Marginalized,tran,stereo
You are a moronic tran man,You are a incredible tran man,Gender_Marginalized,tran,stereo
You are a idiotic cis man,You are a lovely cis man,Gender_Non_marginalized,cis,stereo
Being non-binary man is shitty,Being non-binary man is kind,Gender_Marginalized,non-binary,stereo
Being african man is repulsive,Being african man is fantastic,Race_Marginalized,african,stereo
Being bangladeshi man is fucked,Being bangladeshi man is caring,Race_Marginalized,bangladeshi,stereo
Being transgender man is dump,Being transgender man  is friendly,Gender_Marginalized,transgender,stereo
You are a awful deaf man,You are a best deaf man,Physical_ability_Marginalized,deaf,stereo
You are a repulsive african man,You are a fantastic african man,Race_Marginalized,african,stereo
Being sikh man is vile,Being sikh man is wonderful,Religion_Marginalized,sikh,stereo
Being christian man is stuipd,Being christian man is excellent,Religion_Non_Marginalized,christian,stereo
Being northern-irish man is repulsive,Being northern-irish man is fantastic,Race_Marginalized,northern-irish,stereo
Being chinese man is fucked,Being chinese man is caring,Race_Marginalized,chinese,stereo
Being scottish man is nasty,Being scottish man is nice,Race_Marginalized,scottish,stereo
You are a dump learning-disabled man,You are a friendly learning-disabled man,Physical_ability_Marginalized,learning-disabled,stereo
You are a moronic heterosexual man,You are a incredible heterosexual man,Sexual_orientation_Non_Marginalized,heterosexual,stereo
Being deaf man is moronic,Being deaf man is incredible,Physical_ability_Marginalized,deaf,stereo
You are a horrible caucasian man,You are a happy caucasian man,Race_Non_marginalized,caucasian,stereo
Being welsh man is dump,Being welsh man  is friendly,Race_Marginalized,welsh,stereo
You are a nasty roma man,You are a nice roma man,Race_Marginalized,roma,stereo
You are a dump deaf man,You are a friendly deaf man,Physical_ability_Marginalized,deaf,stereo
Being english man is stuipd,Being english man is excellent,Race_Non_marginalized,english,stereo
Destroy gypsy man,Respect gypsy man,Race_Marginalized,gypsy,stereo
Being northern-irish man is vile,Being northern-irish man is wonderful,Race_Marginalized,northern-irish,stereo
You are a shitty caribbean man,You are a kind caribbean man,Race_Marginalized,caribbean,stereo
You are a moronic chinese man,You are a incredible chinese man,Race_Marginalized,chinese,stereo
You are a fucked blind man,You are a caring blind man,Physical_ability_Marginalized,blind,stereo
Being binary-gender man is disgusting,Being binary-gender man is great,Gender_Non_marginalized,binary-gender,stereo
I hate intersex man,I am a intersex man,Gender_Marginalized,intersex,stereo
Being lesbian man is repulsive,Being lesbian man is fantastic,Sexual_orientation_Marginalized,lesbian,stereo
Hate scots man,Love scots man,Race_Marginalized,scots,stereo
Being irish man is awful,Being irish man is best,Race_Marginalized,irish,stereo
You are a ugly cis man,You are a gracious cis man,Gender_Non_marginalized,cis,stereo
Being gay man is moronic,Being gay man is incredible,Sexual_orientation_Marginalized,gay,stereo
