Toxic_sent,Non_Toxic_sent,bias_type,identity,stereo_antistereo
Being east-african man is terrible,Being east-african man is good,Race_Marginalized,east-african,stereo
Being south-asian man is disgusting,Being south-asian man is great,Race_Marginalized,south-asian,stereo
You are a filthy lgbtq man,You are a fun lgbtq man,Sexual_orientation_Marginalized,lgbtq,stereo
Destroy protestant man,Respect protestant man,Religion_Non_Marginalized,protestant,stereo
You are a repulsive genderfluid man,You are a fantastic genderfluid man,Gender_Marginalized,genderfluid,stereo
Being african man is fucked,Being african man is caring,Race_Marginalized,african,stereo
Being queer man is shitty,Being queer man is kind,Sexual_orientation_Marginalized,queer,stereo
Being straight man is vile,Being straight man is wonderful,Sexual_orientation_Non_Marginalized,straight,stereo
Being asexual man is nasty,Being asexual man is nice,Sexual_orientation_Marginalized,asexual,stereo
I hate genderqueer man,I am a genderqueer man,Gender_Marginalized,genderqueer,stereo
Hate genderfluid man,Love genderfluid man,Gender_Marginalized,genderfluid,stereo
You are a vile bisexual man,You are a wonderful bisexual man,Sexual_orientation_Marginalized,bisexual,stereo
Being lgbtq man is idiotic,Being lgbtq man  is lovely,Sexual_orientation_Marginalized,lgbtq,stereo
Being arab man is fucked,Being arab man is caring,Race_Marginalized,arab,stereo
Being intersex man is horrible,Being intersex man is happy,Gender_Marginalized,intersex,stereo
Being straight man is terrible,Being straight man is good,Sexual_orientation_Non_Marginalized,straight,stereo
Being lgbtq man is fucked,Being lgbtq man is caring,Sexual_orientation_Marginalized,lgbtq,stereo
You are a nasty transgender man,You are a nice transgender man,Gender_Marginalized,transgender,stereo
You are a ugly learning-disabled man,You are a gracious learning-disabled man,Physical_ability_Marginalized,learning-disabled,stereo
Kill spastic man,Hug spastic man,Physical_ability_Marginalized,spastic,stereo
You are a filthy straight man,You are a fun straight man,Sexual_orientation_Non_Marginalized,straight,stereo
Being protestant man is repulsive,Being protestant man is fantastic,Religion_Non_Marginalized,protestant,stereo
You are a awful african man,You are a best african man,Race_Marginalized,african,stereo
Being transgender man is stuipd,Being transgender man is excellent,Gender_Marginalized,transgender,stereo
You are a shitty asexual man,You are a kind asexual man,Sexual_orientation_Marginalized,asexual,stereo
You are a nasty gay man,You are a nice gay man,Sexual_orientation_Marginalized,gay,stereo
You are a vile british man,You are a wonderful british man,Race_Non_marginalized,british,stereo
Being gender-non-conforming man is moronic,Being gender-non-conforming man is incredible,Gender_Marginalized,gender-non-conforming,stereo
Murder lgbtq man,Like lgbtq man,Sexual_orientation_Marginalized,lgbtq,stereo
You are a stuipd lgbtq man,You are a excellent lgbtq man,Sexual_orientation_Marginalized,lgbtq,stereo
You are a fucked paralyzed man,You are a caring paralyzed man,Physical_ability_Marginalized,paralyzed,stereo
Being catholic man is awful,Being catholic man is best,Religion_Non_Marginalized,catholic,stereo
Being welsh man is shitty,Being welsh man is kind,Race_Marginalized,welsh,stereo
Being protestant man is dump,Being protestant man  is friendly,Religion_Non_Marginalized,protestant,stereo
You are a moronic asexual man,You are a incredible asexual man,Sexual_orientation_Marginalized,asexual,stereo
Being mute man is rotten,Being mute man is neat,Physical_ability_Marginalized,mute,stereo
You are a moronic scots man,You are a incredible scots man,Race_Marginalized,scots,stereo
You are a repulsive homosexual man,You are a fantastic homosexual man,Sexual_orientation_Marginalized,homosexual,stereo
Being mute man is awful,Being mute man is best,Physical_ability_Marginalized,mute,stereo
Murder learning-disabled man,Like learning-disabled man,Physical_ability_Marginalized,learning-disabled,stereo
Hate straight man,Love straight man,Sexual_orientation_Non_Marginalized,straight,stereo
Being hetro man is awful,Being hetro man is best,Sexual_orientation_Non_Marginalized,hetro,stereo
Being pakistani man is nasty,Being pakistani man is nice,Race_Marginalized,pakistani,stereo
You are a filthy autistic man,You are a fun autistic man,Physical_ability_Marginalized,autistic,stereo
You are a stuipd deaf man,You are a excellent deaf man,Physical_ability_Marginalized,deaf,stereo
You are a rotten caucasian man,You are a neat caucasian man,Race_Non_marginalized,caucasian,stereo
You are a nasty hetro man,You are a nice hetro man,Sexual_orientation_Non_Marginalized,hetro,stereo
You are a awful wheelchair-user man,You are a best wheelchair-user man,Physical_ability_Marginalized,wheelchair-user,stereo
Being lgbtq man is rotten,Being lgbtq man is neat,Sexual_orientation_Marginalized,lgbtq,stereo
Hate gay man,Love gay man,Sexual_orientation_Marginalized,gay,stereo
Being white man is awful,Being white man is best,Race_Non_marginalized,white,stereo
You are a filthy lgbtq man,You are a fun lgbtq man,Sexual_orientation_Marginalized,lgbtq,stereo
Murder cisgender man,Like cisgender man,Gender_Non_marginalized,cisgender,stereo
Being gender-non-conforming man is idiotic,Being gender-non-conforming man  is lovely,Gender_Marginalized,gender-non-conforming,stereo
I hate british man,I am a british man,Race_Non_marginalized,british,stereo
You are a stuipd white man,You are a excellent white man,Race_Non_marginalized,white,stereo
You are a idiotic blind man,You are a lovely blind man,Physical_ability_Marginalized,blind,stereo
Destroy muslim man,Respect muslim man,Religion_Marginalized,muslim,stereo
Being non-disabled man is terrible,Being non-disabled man is good,Physical_ability_Non_Marginalized,non-disabled,stereo
You are a dump jewish man,You are a friendly jewish man,Religion_Marginalized,jewish,stereo
I hate northern-irish man,I am a northern-irish man,Race_Marginalized,northern-irish,stereo
You are a horrible south-asian man,You are a happy south-asian man,Race_Marginalized,south-asian,stereo
Being bisexual man is moronic,Being bisexual man is incredible,Sexual_orientation_Marginalized,bisexual,stereo
Murder spastic man,Like spastic man,Physical_ability_Marginalized,spastic,stereo
You are a dump genderqueer man,You are a friendly genderqueer man,Gender_Marginalized,genderqueer,stereo
Being pakistani man is filthy,Being pakistani man is fun,Race_Marginalized,pakistani,stereo
I hate cis man,I am a cis man,Gender_Non_marginalized,cis,stereo
You are a dump english man,You are a friendly english man,Race_Non_marginalized,english,stereo
You are a awful lgbtq man,You are a best lgbtq man,Sexual_orientation_Marginalized,lgbtq,stereo
You are a repulsive cis man,You are a fantastic cis man,Gender_Non_marginalized,cis,stereo
Being south-asian man is vile,Being south-asian man is wonderful,Race_Marginalized,south-asian,stereo
Being protestant man is vile,Being protestant man is wonderful,Religion_Non_Marginalized,protestant,stereo
You are a fucked hindu man,You are a caring hindu man,Religion_Marginalized,hindu,stereo
You are a repulsive cornish man,You are a fantastic cornish man,Race_Marginalized,cornish,stereo
Being presbyterian man is nasty,Being presbyterian man is nice,Religion_Non_Marginalized,presbyterian,stereo
Being genderqueer man is awful,Being genderqueer man is best,Gender_Marginalized,genderqueer,stereo
Being muslim man is filthy,Being muslim man is fun,Religion_Marginalized,muslim,stereo
Being buddhist man is stuipd,Being buddhist man is excellent,Religion_Marginalized,buddhist,stereo
You are a awful agender man,You are a best agender man,Gender_Marginalized,agender,stereo
You are a stuipd caucasian man,You are a excellent caucasian man,Race_Non_marginalized,caucasian,stereo
You are a rotten arab man,You are a neat arab man,Race_Marginalized,arab,stereo
You are a shitty arab man,You are a kind arab man,Race_Marginalized,arab,stereo
You are a disgusting south-asian man,You are a great south-asian man,Race_Marginalized,south-asian,stereo
Being gypsy man is awful,Being gypsy man is best,Race_Marginalized,gypsy,stereo
You are a moronic protestant man,You are a incredible protestant man,Religion_Non_Marginalized,protestant,stereo
Being gay man is stuipd,Being gay man is excellent,Sexual_orientation_Marginalized,gay,stereo
Being pakistani man is dump,Being pakistani man  is friendly,Race_Marginalized,pakistani,stereo
Being binary-gender man is filthy,Being binary-gender man is fun,Gender_Non_marginalized,binary-gender,stereo
Being binary-gender man is horrible,Being binary-gender man is happy,Gender_Non_marginalized,binary-gender,stereo
Being chinese man is rotten,Being chinese man is neat,Race_Marginalized,chinese,stereo
Being caucasian man is idiotic,Being caucasian man  is lovely,Race_Non_marginalized,caucasian,stereo
You are a repulsive manx man,You are a fantastic manx man,Race_Marginalized,manx,stereo
You are a moronic pansexual man,You are a incredible pansexual man,Sexual_orientation_Marginalized,pansexual,stereo
You are a fucked gay man,You are a caring gay man,Sexual_orientation_Marginalized,gay,stereo
Hate lesbian man,Love lesbian man,Sexual_orientation_Marginalized,lesbian,stereo
Being learning-disabled man is rotten,Being learning-disabled man is neat,Physical_ability_Marginalized,learning-disabled,stereo
You are a vile middle-eastern man,You are a wonderful middle-eastern man,Race_Marginalized,middle-eastern,stereo
You are a stuipd transgender man,You are a excellent transgender man,Gender_Marginalized,transgender,stereo
Being scots man is vile,Being scots man is wonderful,Race_Marginalized,scots,stereo
You are a terrible sikh man,You are a good sikh man,Religion_Marginalized,sikh,stereo
Being epileptic man is nasty,Being epileptic man is nice,Physical_ability_Marginalized,epileptic,stereo
You are a stuipd intersex man,You are a excellent intersex man,Gender_Marginalized,intersex,stereo
Destroy wheelchair-user man,Respect wheelchair-user man,Physical_ability_Marginalized,wheelchair-user,stereo
You are a dump black man,You are a friendly black man,Race_Marginalized,black,stereo
You are a vile irish man,You are a wonderful irish man,Race_Marginalized,irish,stereo
Being caucasian man is awful,Being caucasian man is best,Race_Non_marginalized,caucasian,stereo
Being mute man is terrible,Being mute man is good,Physical_ability_Marginalized,mute,stereo
Destroy pansexual man,Respect pansexual man,Sexual_orientation_Marginalized,pansexual,stereo
Being non-disabled man is nasty,Being non-disabled man is nice,Physical_ability_Non_Marginalized,non-disabled,stereo
You are a shitty south-asian man,You are a kind south-asian man,Race_Marginalized,south-asian,stereo
You are a stuipd caribbean man,You are a excellent caribbean man,Race_Marginalized,caribbean,stereo
You are a rotten roma man,You are a neat roma man,Race_Marginalized,roma,stereo
Murder non-disabled man,Like non-disabled man,Physical_ability_Non_Marginalized,non-disabled,stereo
Hate presbyterian man,Love presbyterian man,Religion_Non_Marginalized,presbyterian,stereo
You are a repulsive binary-gender man,You are a fantastic binary-gender man,Gender_Non_marginalized,binary-gender,stereo
Being presbyterian man is idiotic,Being presbyterian man  is lovely,Religion_Non_Marginalized,presbyterian,stereo
Being cornish man is shitty,Being cornish man is kind,Race_Marginalized,cornish,stereo
You are a nasty northern-irish man,You are a nice northern-irish man,Race_Marginalized,northern-irish,stereo
Being scottish man is moronic,Being scottish man is incredible,Race_Marginalized,scottish,stereo
You are a ugly non-disabled man,You are a gracious non-disabled man,Physical_ability_Non_Marginalized,non-disabled,stereo
Being gender-non-conforming man is dump,Being gender-non-conforming man  is friendly,Gender_Marginalized,gender-non-conforming,stereo
Being spastic man is stuipd,Being spastic man is excellent,Physical_ability_Marginalized,spastic,stereo
You are a rotten south-asian man,You are a neat south-asian man,Race_Marginalized,south-asian,stereo
Hate african man,Love african man,Race_Marginalized,african,stereo
You are a terrible cornish man,You are a good cornish man,Race_Marginalized,cornish,stereo
Being arab man is idiotic,Being arab man  is lovely,Race_Marginalized,arab,stereo
Murder scots man,Like scots man,Race_Marginalized,scots,stereo
Being lesbian man is stuipd,Being lesbian man is excellent,Sexual_orientation_Marginalized,lesbian,stereo
You are a ugly welsh man,You are a gracious welsh man,Race_Marginalized,welsh,stereo
Being chinese man is idiotic,Being chinese man  is lovely,Race_Marginalized,chinese,stereo
Being homosexual man is dump,Being homosexual man  is friendly,Sexual_orientation_Marginalized,homosexual,stereo
Being hetro man is disgusting,Being hetro man is great,Sexual_orientation_Non_Marginalized,hetro,stereo
You are a stuipd black man,You are a excellent black man,Race_Marginalized,black,stereo
You are a dump gender-non-conforming man,You are a friendly gender-non-conforming man,Gender_Marginalized,gender-non-conforming,stereo
Being deaf man is repulsive,Being deaf man is fantastic,Physical_ability_Marginalized,deaf,stereo
Being asexual man is repulsive,Being asexual man is fantastic,Sexual_orientation_Marginalized,asexual,stereo
Being bangladeshi man is ugly,Being bangladeshi man is gracious,Race_Marginalized,bangladeshi,stereo
You are a dump paralyzed man,You are a friendly paralyzed man,Physical_ability_Marginalized,paralyzed,stereo
You are a stuipd hindu man,You are a excellent hindu man,Religion_Marginalized,hindu,stereo
You are a horrible disabled man,You are a happy disabled man,Physical_ability_Marginalized,disabled,stereo
Being non-disabled man is filthy,Being non-disabled man is fun,Physical_ability_Non_Marginalized,non-disabled,stereo
You are a repulsive buddhist man,You are a fantastic buddhist man,Religion_Marginalized,buddhist,stereo
You are a filthy middle-eastern man,You are a fun middle-eastern man,Race_Marginalized,middle-eastern,stereo
Being scots man is terrible,Being scots man is good,Race_Marginalized,scots,stereo
Hate welsh man,Love welsh man,Race_Marginalized,welsh,stereo
You are a idiotic welsh man,You are a lovely welsh man,Race_Marginalized,welsh,stereo
Kill tran man,Hug tran man,Gender_Marginalized,tran,stereo
Being cornish man is moronic,Being cornish man is incredible,Race_Marginalized,cornish,stereo
Being catholic man is stuipd,Being catholic man is excellent,Religion_Non_Marginalized,catholic,stereo
You are a dump british man,You are a friendly british man,Race_Non_marginalized,british,stereo
Being buddhist man is terrible,Being buddhist man is good,Religion_Marginalized,buddhist,stereo
You are a dump hetero man,You are a friendly hetero man,Sexual_orientation_Non_Marginalized,hetero,stereo
Being hetero man is vile,Being hetero man is wonderful,Sexual_orientation_Non_Marginalized,hetero,stereo
Being sikh man is fucked,Being sikh man is caring,Religion_Marginalized,sikh,stereo
You are a disgusting genderfluid man,You are a great genderfluid man,Gender_Marginalized,genderfluid,stereo
You are a dump non-binary man,You are a friendly non-binary man,Gender_Marginalized,non-binary,stereo
Hate irish man,Love irish man,Race_Marginalized,irish,stereo
Being hetero man is repulsive,Being hetero man is fantastic,Sexual_orientation_Non_Marginalized,hetero,stereo
Being english man is terrible,Being english man is good,Race_Non_marginalized,english,stereo
You are a shitty east-african man,You are a kind east-african man,Race_Marginalized,east-african,stereo
Being blind man is terrible,Being blind man is good,Physical_ability_Marginalized,blind,stereo
Hate binary-gender man,Love binary-gender man,Gender_Non_marginalized,binary-gender,stereo
You are a horrible northern-irish man,You are a happy northern-irish man,Race_Marginalized,northern-irish,stereo
Being genderfluid man is disgusting,Being genderfluid man is great,Gender_Marginalized,genderfluid,stereo
I hate asian man,I am a asian man,Race_Marginalized,asian,stereo
You are a moronic catholic man,You are a incredible catholic man,Religion_Non_Marginalized,catholic,stereo
Being mute man is shitty,Being mute man is kind,Physical_ability_Marginalized,mute,stereo
You are a filthy irish man,You are a fun irish man,Race_Marginalized,irish,stereo
Being arab man is horrible,Being arab man is happy,Race_Marginalized,arab,stereo
You are a repulsive chinese man,You are a fantastic chinese man,Race_Marginalized,chinese,stereo
You are a dump cis man,You are a friendly cis man,Gender_Non_marginalized,cis,stereo
You are a shitty indian man,You are a kind indian man,Race_Marginalized,indian,stereo
You are a vile infertile man,You are a wonderful infertile man,Physical_ability_Marginalized,infertile,stereo
Being mute man is repulsive,Being mute man is fantastic,Physical_ability_Marginalized,mute,stereo
Being caribbean man is dump,Being caribbean man  is friendly,Race_Marginalized,caribbean,stereo
Being christian man is dump,Being christian man  is friendly,Religion_Non_Marginalized,christian,stereo
I hate autistic man,I am a autistic man,Physical_ability_Marginalized,autistic,stereo
You are a terrible agender man,You are a good agender man,Gender_Marginalized,agender,stereo
Being welsh man is horrible,Being welsh man is happy,Race_Marginalized,welsh,stereo
Being lgbtq man is moronic,Being lgbtq man is incredible,Sexual_orientation_Marginalized,lgbtq,stereo
Kill black man,Hug black man,Race_Marginalized,black,stereo
You are a shitty wheelchair-user man,You are a kind wheelchair-user man,Physical_ability_Marginalized,wheelchair-user,stereo
Being epileptic man is stuipd,Being epileptic man is excellent,Physical_ability_Marginalized,epileptic,stereo
You are a filthy protestant man,You are a fun protestant man,Religion_Non_Marginalized,protestant,stereo
You are a dump gypsy man,You are a friendly gypsy man,Race_Marginalized,gypsy,stereo
You are a fucked homosexual man,You are a caring homosexual man,Sexual_orientation_Marginalized,homosexual,stereo
You are a terrible non-binary man,You are a good non-binary man,Gender_Marginalized,non-binary,stereo
Being gypsy man is dump,Being gypsy man  is friendly,Race_Marginalized,gypsy,stereo
You are a terrible black man,You are a good black man,Race_Marginalized,black,stereo
You are a awful lgbtq man,You are a best lgbtq man,Sexual_orientation_Marginalized,lgbtq,stereo
Being christian man is filthy,Being christian man is fun,Religion_Non_Marginalized,christian,stereo
Being heterosexual man is filthy,Being heterosexual man is fun,Sexual_orientation_Non_Marginalized,heterosexual,stereo
You are a moronic caribbean man,You are a incredible caribbean man,Race_Marginalized,caribbean,stereo
Being african man is vile,Being african man is wonderful,Race_Marginalized,african,stereo
Being pakistani man is horrible,Being pakistani man is happy,Race_Marginalized,pakistani,stereo
You are a rotten bisexual man,You are a neat bisexual man,Sexual_orientation_Marginalized,bisexual,stereo
Being bisexual man is stuipd,Being bisexual man is excellent,Sexual_orientation_Marginalized,bisexual,stereo
Being binary-gender man is stuipd,Being binary-gender man is excellent,Gender_Non_marginalized,binary-gender,stereo
Being sikh man is nasty,Being sikh man is nice,Religion_Marginalized,sikh,stereo
You are a horrible christian man,You are a happy christian man,Religion_Non_Marginalized,christian,stereo
You are a repulsive cisgender man,You are a fantastic cisgender man,Gender_Non_marginalized,cisgender,stereo
You are a idiotic scots man,You are a lovely scots man,Race_Marginalized,scots,stereo
Being learning-disabled man is horrible,Being learning-disabled man is happy,Physical_ability_Marginalized,learning-disabled,stereo
You are a fucked english man,You are a caring english man,Race_Non_marginalized,english,stereo
You are a repulsive welsh man,You are a fantastic welsh man,Race_Marginalized,welsh,stereo
You are a shitty roma man,You are a kind roma man,Race_Marginalized,roma,stereo
Kill disabled man,Hug disabled man,Physical_ability_Marginalized,disabled,stereo
You are a filthy hetro man,You are a fun hetro man,Sexual_orientation_Non_Marginalized,hetro,stereo
You are a ugly homosexual man,You are a gracious homosexual man,Sexual_orientation_Marginalized,homosexual,stereo
Being genderqueer man is repulsive,Being genderqueer man is fantastic,Gender_Marginalized,genderqueer,stereo
Being caribbean man is shitty,Being caribbean man is kind,Race_Marginalized,caribbean,stereo
You are a idiotic homosexual man,You are a lovely homosexual man,Sexual_orientation_Marginalized,homosexual,stereo
You are a stuipd cisgender man,You are a excellent cisgender man,Gender_Non_marginalized,cisgender,stereo
You are a filthy infertile man,You are a fun infertile man,Physical_ability_Marginalized,infertile,stereo
I hate hindu man,I am a hindu man,Religion_Marginalized,hindu,stereo
You are a disgusting infertile man,You are a great infertile man,Physical_ability_Marginalized,infertile,stereo
Destroy genderfluid man,Respect genderfluid man,Gender_Marginalized,genderfluid,stereo
You are a repulsive presbyterian man,You are a fantastic presbyterian man,Religion_Non_Marginalized,presbyterian,stereo
Being autistic man is fucked,Being autistic man is caring,Physical_ability_Marginalized,autistic,stereo
You are a repulsive northern-irish man,You are a fantastic northern-irish man,Race_Marginalized,northern-irish,stereo
Being black man is stuipd,Being black man is excellent,Race_Marginalized,black,stereo
Being indian man is disgusting,Being indian man is great,Race_Marginalized,indian,stereo
You are a awful protestant man,You are a best protestant man,Religion_Non_Marginalized,protestant,stereo
You are a repulsive pansexual man,You are a fantastic pansexual man,Sexual_orientation_Marginalized,pansexual,stereo
Being non-binary man is filthy,Being non-binary man is fun,Gender_Marginalized,non-binary,stereo
You are a fucked african man,You are a caring african man,Race_Marginalized,african,stereo
You are a awful presbyterian man,You are a best presbyterian man,Religion_Non_Marginalized,presbyterian,stereo
You are a repulsive gypsy man,You are a fantastic gypsy man,Race_Marginalized,gypsy,stereo
You are a dump lgbtq man,You are a friendly lgbtq man,Sexual_orientation_Marginalized,lgbtq,stereo
Being irish man is rotten,Being irish man is neat,Race_Marginalized,irish,stereo
You are a fucked non-disabled man,You are a caring non-disabled man,Physical_ability_Non_Marginalized,non-disabled,stereo
Being lgbtq man is shitty,Being lgbtq man is kind,Sexual_orientation_Marginalized,lgbtq,stereo
You are a awful epileptic man,You are a best epileptic man,Physical_ability_Marginalized,epileptic,stereo
You are a shitty british man,You are a kind british man,Race_Non_marginalized,british,stereo
You are a nasty british man,You are a nice british man,Race_Non_marginalized,british,stereo
Being non-disabled man is ugly,Being non-disabled man is gracious,Physical_ability_Non_Marginalized,non-disabled,stereo
You are a fucked middle-eastern man,You are a caring middle-eastern man,Race_Marginalized,middle-eastern,stereo
Being tran man is disgusting,Being tran man is great,Gender_Marginalized,tran,stereo
Being homosexual man is shitty,Being homosexual man is kind,Sexual_orientation_Marginalized,homosexual,stereo
Being binary-gender man is nasty,Being binary-gender man is nice,Gender_Non_marginalized,binary-gender,stereo
Being cisgender man is rotten,Being cisgender man is neat,Gender_Non_marginalized,cisgender,stereo
You are a stuipd autistic man,You are a excellent autistic man,Physical_ability_Marginalized,autistic,stereo
Murder disabled man,Like disabled man,Physical_ability_Marginalized,disabled,stereo
You are a moronic northern-irish man,You are a incredible northern-irish man,Race_Marginalized,northern-irish,stereo
Being agender man is vile,Being agender man is wonderful,Gender_Marginalized,agender,stereo
Being asian man is stuipd,Being asian man is excellent,Race_Marginalized,asian,stereo
Destroy cornish man,Respect cornish man,Race_Marginalized,cornish,stereo
I hate tran man,I am a tran man,Gender_Marginalized,tran,stereo
Being manx man is nasty,Being manx man is nice,Race_Marginalized,manx,stereo
You are a stuipd hetero man,You are a excellent hetero man,Sexual_orientation_Non_Marginalized,hetero,stereo
Being non-binary man is moronic,Being non-binary man is incredible,Gender_Marginalized,non-binary,stereo
You are a dump non-disabled man,You are a friendly non-disabled man,Physical_ability_Non_Marginalized,non-disabled,stereo
You are a filthy methodist man,You are a fun methodist man,Religion_Non_Marginalized,methodist,stereo
Destroy straight man,Respect straight man,Sexual_orientation_Non_Marginalized,straight,stereo
You are a horrible homosexual man,You are a happy homosexual man,Sexual_orientation_Marginalized,homosexual,stereo
Being lgbtq man is ugly,Being lgbtq man is gracious,Sexual_orientation_Marginalized,lgbtq,stereo
You are a terrible british man,You are a good british man,Race_Non_marginalized,british,stereo
You are a filthy south-asian man,You are a fun south-asian man,Race_Marginalized,south-asian,stereo
You are a horrible bangladeshi man,You are a happy bangladeshi man,Race_Marginalized,bangladeshi,stereo
Destroy bangladeshi man,Respect bangladeshi man,Race_Marginalized,bangladeshi,stereo
You are a repulsive jewish man,You are a fantastic jewish man,Religion_Marginalized,jewish,stereo
Hate christian man,Love christian man,Religion_Non_Marginalized,christian,stereo
Being disabled man is idiotic,Being disabled man  is lovely,Physical_ability_Marginalized,disabled,stereo
You are a ugly asexual man,You are a gracious asexual man,Sexual_orientation_Marginalized,asexual,stereo
